id,life_stage,theme,summary,quote,emotion,values,sociological_note,type,institution,housing_promised,market_participation,collapse_context,digital_literacy
5,"Пенсия, настоящее",Экологические привычки и отношение к природе,"Респондентка придерживается некоторых экологических привычек, не мусорит, сортирует отходы, но не считает себя активисткой. Вопросы экологии воспринимает как не зависящие от нее лично.","Понимаю, от меня здесь ничего ровным счетом не зависит.","Сдержанность, легкая апатия","Ответственность, уважение к природе","Экологические практики у пожилых людей часто связаны с личной ответственностью, но отсутствует вера в возможность повлиять на ситуацию в целом.",декларация,,,,,
6,"Пенсия, настоящее",Семейные традиции и праздники,"Праздники отмечаются по привычке, в основном остались советские традиции. Формат праздников изменился: меньше гостей, больше символических действий, меньше застолий.","Праздники, традиции праздничные, все оставшиеся с советских времен. 8 марта, 23 февраля, нерождение.","Ностальгия, легкая грусть","Память, традиции, семейственность","С возрастом праздники теряют массовость, становятся более камерными, что связано с уходом старого круга общения.",узел,,,,,
7,"Пенсия, настоящее",Отдых и отпуск,"Респондентка и муж регулярно ездят в отпуск, чаще всего на море. Организацией поездок занимается муж. Для респондентки в отдыхе главное — отсутствие обязательств и возможность делать то, что хочется.","Для меня, знаете, отсутствие обязательств. Я делала, что я хочу, не делала, чего не хочу, когда хочется.","Желание свободы, благодарность","Свобода, отдых, независимость","Для пожилых людей отпуск становится не только сменой обстановки, но и возможностью временно избавиться от бытовых и семейных обязанностей.",эпизод,,,,,
8,"Пенсия, настоящее",Оценка текущего распорядка дня и самочувствия,"Респондентка испытывает амбивалентные чувства: с одной стороны, ценит свободу и вариативность, с другой — недовольна отсутствием организованности и самодисциплины.","Я доверена тем, что я имею возможность вариативности. И я недовольна тем, что меня мальчок пустил.","Амбивалентность, легкое разочарование","Свобода, самодисциплина","Свобода от обязательств может вызывать не только облегчение, но и внутренний конфликт из-за нехватки структуры.",декларация,,,,,
9,"Пенсия, настоящее",Дружба и социальные связи,"Старые друзья ушли, остались приятельские отношения и новые знакомства. Для респондентки важны комфорт и надежность в общении, конфликты с друзьями обычно разрешаются сами собой.","К сожалению от старых друзей уже ничего не осталось, они ушли. То есть я Приятельства те остались, мы периодически нечистые. Мы встречаемся, общаемся с большими людьми.","Грусть, принятие","Доверие, комфорт, надежность","В пожилом возрасте круг общения сужается, но сохраняется потребность в эмоциональной поддержке и доверии.",узел,,,,,
1,"Зрелый возраст, семейная жизнь",Отношения с близкими и поддержка,"Респондентка размышляет о своих отношениях с близкими, отмечает, что обращается за поддержкой к мужу, но в целом чувствует недооцененность и неудовлетворенность качеством отношений. Испытывает потребность во внимании и заботе, но считает, что не смогла правильно выстроить отношения с семьей.","Я, наверное, неправильно сложила отношения, сформировала отношения со своими близкими. Вот это да! А это что такое? Мне бы хотелось других отношений, но понятно, что я не стилист. Мне бы хотелось больше внимания, проявления внимания.","Сожаление, неудовлетворенность, легкая обида","Внимание, поддержка, семейные отношения, взаимопомощь","Респондентка демонстрирует типичную для зрелого возраста рефлексию по поводу семейных ролей и поддержки. Чувство недооцененности может быть связано с изменением структуры семьи (например, взросление детей, уход на пенсию) и снижением социальной вовлеченности.",узел,семья,,,,
2,Зрелый возраст,Отношение к здоровью и забота о себе,"Респондентка воспринимает заботу о здоровье как сложную и даже болезненную тему, сожалеет об упущенных возможностях. Поддерживает здоровье в основном за счет выполнения предписаний врача и периодических попыток заниматься гимнастикой, но не придает этому большого значения.","Для меня это скорее сожаление, а в упущенных возможностях и не сделанном. И не более того, это что у меня создало... Насколько хуже нет в моем возрасте, то, что... Спасибо, Катюшка. У меня то, что доктор назначает, пьет.","Сожаление, апатия","Здоровье, ответственность, принятие возраста","Отношение к здоровью носит пассивный характер, что типично для части пожилых людей, которые не склонны к активному самоуправлению здоровьем и больше полагаются на врачей и предписания.",эпизод,медицина,,,,
3,Зрелый возраст,Пищевые привычки и отношение к еде,"Респондентка безразлична к типу продуктов, но придает большое значение эстетике подачи пищи. Для нее важно, чтобы еда была красиво сервирована, даже если это простые блюда.","Мне нужно, чтобы были салфетки, мне нужно, чтобы картошка была красивым веером, мне нужно, чтобы салатик был разложен, как должно. Вот этому я... Чтобы колбаска ливерная была порезана ровным колечком.","Удовольствие, спокойствие","Эстетика, порядок, забота о себе","Внимание к эстетике еды может быть способом самоуважения и поддержания чувства контроля в повседневной жизни, особенно при снижении других сфер активности.",эпизод,,,потребление,,
4,Зрелый возраст,"Режим дня, физическая активность и желания","Респондентка хотела бы изменить свой образ жизни: вставать рано, больше гулять, структурировать рабочий день, но признает, что не реализует эти желания. Отмечает нехватку физической активности и воды, а также склонность к перееданию на ночь.","Мне бы очень хотелось бы вставать рано. Я периодически это делаю, но не переживайте. Мне бы хотелось выгнать график работы и денег. Мне бы хотелось непременно выходить, прогуляться вечером перед сном.","Сожаление, неудовлетворенность","Самодисциплина, здоровье, порядок","Нереализованные желания по изменению образа жизни часто встречаются у людей зрелого возраста, что связано с устоявшимися привычками и снижением мотивации к переменам.",декларация,,,,,
5,Зрелый возраст,Психологическое состояние и саморефлексия,"Респондентка отмечает склонность к самокопанию, жалости к себе, что негативно влияет на ее эмоциональное состояние. Она недовольна собой, испытывает тревожность и подавленность, но справляется с этим, просто ожидая, когда пройдет.","Паническое настроение. Я очень люблю себе копаться, себя жалеть. В итоге я делаю много для себя. Ничем это выражается.","Тревожность, подавленность, самокритика","Рефлексия, эмоциональная честность","Высокий уровень саморефлексии и склонность к самокритике могут быть следствием одиночества или недостатка внешней поддержки, что характерно для части пожилых женщин.",узел,,,,,
6,Зрелый возраст,Медицинские практики и отношение к медицине,"Респондентка регулярно принимает лекарства от хронических заболеваний, доверяет официальной медицине, но критикует современную систему за формализм и недостаток индивидуального подхода. Отмечает, что качество медицины не зависит от формы собственности учреждения, а от конкретного специалиста.","Медицина в целом, это хорошо, я не против официальной медицины, я не против фармакологии, я обеим руками сам, потому что травмами буквально не все вылечишь. А вот медицина, которая есть в деятельности сейчас, нет.","Критика, разочарование, прагматизм","Профессионализм, индивидуальный подход, рациональность","Критика формализма и бюрократии в медицине типична для старшего поколения, имеющего опыт советской и постсоветской медицины. Ориентация на личность врача, а не на учреждение, отражает недоверие к системам и поиск индивидуального подхода.",декларация,государственная и частная медицина,,потребление медицинских услуг,,
7,Зрелый возраст,Опыт обращения за медицинской помощью,"Респондентка обращается как в государственные, так и в частные клиники, но отмечает, что полное обследование и лечение в частных клиниках ей не по карману. В целом довольна найденными специалистами, особенно массажистом, но сталкивалась и с некачественной медицинской помощью.","Если счёт честного переклинивания так, как мне бы хотелось, вот с полным обследованием, с полным лечением, то есть это мне не по карману.","Прагматизм, благодарность, разочарование","Доступность, качество, профессионализм","Финансовые ограничения влияют на выбор медицинских услуг, что типично для пожилых людей с фиксированным доходом. Оценка медицины строится на личном опыте и конкретных случаях.",эпизод,государственная и частная медицина,,потребление медицинских услуг,,
8,Зрелый возраст,Отношение к вакцинации,"Респондентка положительно относится к вакцинации, готова делать прививки, если есть необходимость, но не проявляет избыточной инициативы.","Ну, сейчас у меня нет необходимости, но я бы и так помогла Маку от ковида. То есть я бы сделала клипы перед этим.","Спокойствие, рациональность","Здравый смысл, ответственность",Прагматичное отношение к вакцинации характерно для людей с доверием к официальной медицине и отсутствием выраженных антивакцинаторских настроений.,декларация,медицина,,,,
9,Зрелый возраст,Психологическая помощь и отношение к ней,"Респондентка положительно относится к психологической помощи, хотя сама не обращалась, но видит пользу по отзывам знакомых. Считает, что если человеку нужна поддержка, то это важно.","положительно у меня есть знакомая Я просто вижу отзывы, которые пишут ей люди. Нет, ну а и что? Конечно, важно.","Понимание, принятие","Поддержка, забота о психическом здоровье",Позитивное отношение к психологической помощи свидетельствует о постепенном снижении стигмы вокруг психотерапии среди старшего поколения.,декларация,,,,,
10,Зрелый возраст,Забота о здоровье близких и опыт ухода,"Респондентка переживает за здоровье близких, особенно сына, пытается мотивировать его проходить обследования, но сталкивается с сопротивлением. Имеет опыт ухода за больными родственниками, активирует социальные связи для организации помощи.","Ну, если вот как бы так прямолинейно, то, зная, на что он усваивается, да, на его полу, понимаешь, что нужно пройти обследование. ... Я желаю, что Роману было 1 минуту до суток. Потому что я подозреваю, что он лишний раз помолчал, потому что я опять соберу привычную песню, пойду.","Тревога, забота, бессилие","Забота, ответственность, семья","Забота о здоровье близких и опыт ухода типичны для женщин старшего возраста, которые часто берут на себя роль координатора семейного благополучия.",эпизод,"семья, неформальные сети поддержки",,,,
11,Зрелый возраст,Страхи и ожидания относительно будущего здоровья,"Респондентка задумывается о будущем, боится оказаться в ситуации, когда потребуется уход, не хочет быть обузой для близких. Рассчитывает на детей, но не уверена в их готовности заботиться.","Больше всего мне хотелось бы стать адресом терапевтических отделов ЧАЭС. Никаких отменок, никаких отменок, ничего того, что не возит в решетку.","Тревога, страх, неуверенность","Достоинство, независимость, забота","Страх стать обузой и размышления о будущем уходе характерны для пожилых людей, особенно женщин, и отражают недостаток формальных институтов долгосрочного ухода.",перелом,"семья, потенциально социальные службы",,,,
1,"Зрелый возраст, пенсионный период",Забота о близких и эмоциональное выгорание,"Респондентка испытывает трудности в заботе о близких, ощущает усталость и невозможность изменить ситуацию, несмотря на готовность следовать медицинским рекомендациям.","Для меня в этом теме важно только одно, что я ничего не могу сделать для своих близких... Для меня сложно, и очень утомительно постоянно из малого тянуть ноги.","Усталость, бессилие, фрустрация","Забота о семье, ответственность, самопожертвование","Респондентка сталкивается с типичной для пожилых людей ситуацией, когда забота о близких становится эмоционально и физически истощающей, а ресурсы ограничены.",эпизод,,,,True,
2,Пенсионный возраст,Финансовое положение и расходы,"Респондентка отмечает, что пенсии и зарплаты не всегда хватает, приходится экономить, основные расходы — медицина, жилье, подарки близким.","Это значит, что мне не всегда хватает моей пенсии и моих зарплат... У нас основные деньги не хватили на больницу.","Недовольство, тревога","Бережливость, забота о здоровье, поддержка близких",Финансовая нестабильность и приоритет медицинских расходов характерны для пожилых людей с ограниченными доходами.,декларация,,,низкая,True,
3,"Вся жизнь, трудовой путь",Отношение к тратам и потреблению,"Респондентка привыкла жить скромно, не склонна к спонтанным покупкам, не использует маркетплейсы из-за технических сложностей.","Нет привычки, широко тратить деньги. Я всю жизнь получала немного...","Сдержанность, рациональность","Экономность, рациональность, самостоятельность",Скромное потребление и низкая цифровая грамотность типичны для старшего поколения.,декларация,,,очень низкая,True,
4,Зрелый возраст,Покупки и принятие решений о крупных тратах,"Респондентка избегает крупных покупок, предпочитает экономные варианты, не склонна брать кредиты, выбирает товары по необходимости и цене.","Я не считаю правильным закупать технику, мебель и все прочее, пока могут быть люди... Например, я пробовала в холодильнике, там сколько-то 250 тысяч, а теперь у него скидка целых 100 тысяч, то мы его все равно покупать не будем. А купим мы какой-нибудь, не знаю, саратов.","Осторожность, прагматизм","Практичность, экономия, ответственность",Осторожное отношение к крупным тратам и кредитам отражает опыт жизни в условиях ограниченных ресурсов.,эпизод,,,низкая,True,
5,Зрелый возраст,Покупки и предпочтения,"Респондентка предпочитает новые вещи, не доверяет подержанным товарам, делает покупки в супермаркетах, редко пользуется доставкой.","Я предпочитаю малое. Так как у меня всегда добросовестные предательства, даже на клещи.","Недоверие, осторожность","Чистота, аккуратность, рациональность",Недоверие к подержанным вещам и предпочтение крупных магазинов характерны для старшего поколения.,декларация,,,традиционная розница,True,
6,Зрелый возраст,Собственность и имущественные вопросы,"У респондентки нет собственности, это ее осознанное решение.","У меня в собственности нет ничего. Это, это, это, это мое решение.","Спокойствие, принятие","Независимость, осознанность",Отсутствие собственности может быть связано с личными убеждениями или семейными обстоятельствами.,декларация,отсутствие собственности,,,True,
