id,life_stage,theme,summary,quote,emotion,values,sociological_note,type,institution,collapse_context,housing_promised,market_participation
11,Ранняя взрослость,Переосмысление жизненных приоритетов,"На четвертом курсе, после смерти бабушки и дедушки, респондент пережил переоценку ценностей, отказался от погони за богатством и популярностью, удалил соцсети, стал больше ценить размеренную жизнь и личное развитие.","Я начал прекрасно себя чувствовать после того, как перестал минаться за богатством, за популярностью, за другими вещами, за прочим. Удалил соцсети и стал, ну, наверное, раз в 10 меньше времени проводить в телефоне, в ноутбуке, за играми, за соцсетями.","освобождение, спокойствие","саморазвитие, внутренний комфорт, осознанность","Переосмысление жизненных целей часто связано с личными потерями и кризисами, что ведет к формированию новых стратегий и отказу от навязанных обществом стандартов успеха.",перелом,,1.0,,
12,Ранняя взрослость,Финансовая поддержка семьи,"Респондент оказывает финансовую помощь родственникам по собственной инициативе, особенно крестной и ее сыну, поскольку у них сложная жизненная ситуация.",Это мое желание и мое начинание. Я помогаю лишь исключительно по своей инициативе.,"ответственность, забота","альтруизм, семья, поддержка",Готовность помогать родственникам свидетельствует о высокой степени семейной солидарности и личной ответственности.,декларация,,1.0,,
13,Ранняя взрослость,Отношение к партнерству и личной жизни,"Респондент серьезно относится к поиску партнера, но не планирует это специально, считает, что встреча произойдет спонтанно.","Я могу вам сказать, Евгений, что я через столько планирую, планирую, но я сейчас выйду с вами на конференции гулять, Нет, повстречается мне та самая, и все. Оно же так обычно бывает.","спокойствие, принятие","осознанность, серьезность, открытость к жизни","Отношение к личной жизни как к естественному процессу, а не к проекту, отражает современную установку на индивидуализм и принятие неопределенности.",декларация,,1.0,,
1,"Молодая взрослость, самостоятельная жизнь",Отношение к родительству и семейной ответственности,"Респондент размышляет о родительстве, подчеркивает готовность взять на себя ответственность за семью, но считает, что решение о детях должно приниматься совместно с партнершей. В случае, если партнерша не готова к рождению детей, рассматривает возможность усыновления.","Я думаю, что хочу, но рожать не мне. Рожать и женщине моей. ... Готов взять такую ответственность, готов. Пронести ее, даже пускай не имея опыта, тем не менее, все его когда-либо получают в этой жизни.","Спокойная уверенность, зрелость","Ответственность, уважение к партнеру, готовность к компромиссу, забота о других","Респондент демонстрирует современные взгляды на партнерство и родительство, подчеркивая совместное принятие решений и готовность к альтернативным формам семьи (усыновление).",декларация,,,True,стабильная финансовая самостоятельность
2,Молодая взрослость,Семейные традиции и поддержка,"Респондент описывает семейные традиции, связанные с совместным празднованием крупных праздников и днями рождения, а также подчеркивает важность взаимной поддержки в семье.","Дни рождения обязательно, вне зависимости от условий, проводим. Даже когда я был в армии, они приезжали ко мне. ... Обязательно поддержка друг друга. Это, конечно, обязательно.","Теплота, благодарность","Семейная сплоченность, поддержка, традиции","Семья выступает важным источником поддержки и эмоциональной стабильности, несмотря на отсутствие регулярных неформальных контактов вне праздников.",эпизод,семья,,,
3,Молодая взрослость,Дружба и социальные связи,"Респондент рассказывает о единственном настоящем друге, с которым познакомился в армии, и о том, как их сблизили совместные трудности и общие интересы.","Есть. Один друг. У меня есть друг. Причем, кстати, друг из армии. Мы с ним поладили, познакомились с самым снежным Новгородом.","Сдержанная привязанность, некоторая неуверенность","Верность, доверие, общие интересы","Опыт армии становится важным социальным лифтом и местом формирования крепких дружеских связей, однако респондент рефлексирует над сложностью определения настоящей дружбы.",эпизод,армия,,,
4,Молодая взрослость,Социальный досуг и спортивное окружение,"Респондент описывает круг общения, связанный со спортом, и регулярные встречи с друзьями и знакомыми, подчеркивая значимость совместного досуга и спортивных интересов.",Это действующий чемпион мира в юношеской категории до 21 года Евгений Байдусов в грекинской борьбе. ... Все ребята спортивные. Все ребята с великолепной харизмой и с прекрасным чувством юмора.,"Гордость, радость","Дружба, спорт, активный образ жизни, юмор",Спортивное сообщество формирует устойчивый круг общения и поддерживает позитивную идентичность респондента.,эпизод,,,,активное участие в спортивных сообществах
5,Переходный этап между подростковым возрастом и взрослостью,Конфликты и разрыв дружеских связей,"Респондент вспоминает болезненный разрыв с группой друзей, который произошел неожиданно и без объяснений, и рефлексирует над причинами и своим отношением к этому событию.","В один момент встреча у нас проходила на тот момент в парке. Я прихожу. Мне в лицо говорят, ну ты как-то поменялся. ... Я стоял так же.","Растерянность, спокойное принятие","Саморефлексия, принятие перемен, независимость",Опыт внезапного разрыва с группой сверстников типичен для переходного возраста и способствует формированию самостоятельной идентичности.,перелом,,,,
6,Молодая взрослость,Рефлексия о настоящей дружбе,"Респондент рассуждает о критериях настоящей дружбы, используя метафоры и гипотетические ситуации, и отмечает, что пока не попадал в критические ситуации, чтобы проверить друзей.","Вот вы, Евгений, сломаете ногу. ... Ну, другу позвоните. Придет, не придет. Вот так понимается ситуация.",Философская задумчивость,"Доверие, честность, испытание временем","Респондент демонстрирует критическое отношение к современным формам дружбы, противопоставляя их более традиционным представлениям о верности.",декларация,,,,
7,Молодая взрослость,Отношение к животным и моральные принципы,"Респондент рассказывает о спасении котенка, найденного на помойке, и подчеркивает, что поступил так из моральных соображений, хотя не испытывает сильной эмоциональной привязанности к животным.","Я услышал мяуканье из мусорки, чисто случайно. ... Здесь сыграла уже просто моральная этика, знаете.","Сдержанная эмпатия, рациональность","Моральная ответственность, гуманизм","Поступок респондента иллюстрирует внутренние моральные установки, которые не всегда связаны с эмоциональной вовлеченностью.",эпизод,,1.0,,
8,Детство и подростковый возраст,Семейная поддержка и отсутствие материального достатка,"Респондент вспоминает детство, отмечая, что несмотря на бедность, всегда чувствовал любовь и заботу со стороны семьи.","Я не чувствую недостатка любви. Не чувствую недостатка внимания. Никогда не чувствовал. Да, мы были там бедны. Я понимал, что мы не можем позволить игрушки, поэтому не капризничал.","Благодарность, уважение","Семейная поддержка, уважение к труду родителей, благодарность","Опыт материальных ограничений компенсируется эмоциональной поддержкой семьи, что формирует устойчивую позитивную самооценку.",эпизод,семья,,,
9,Молодая взрослость,Доверие и значимые отношения,"Респондент выделяет мать как самого близкого и доверенного человека, отмечая, что это типично для большинства людей.",Это моя мать.,"Теплота, доверие","Семейная близость, доверие","Мать занимает центральное место в системе доверия респондента, что отражает традиционные семейные ценности.",декларация,,,,
10,Молодая взрослость,Помощь и поддержка другим,"Респондент рассказывает о случаях, когда оказывает моральную поддержку и помощь окружающим, не давая советов, а просто выслушивая. Приводит пример помощи незнакомой девочке.","Я не даю психологических советов, я просто сажусь и выслушиваю человека. ... Конечно, все. Взяли, купили мороженое, сидели на лавочке, подождали такси. Посадил ее в такси, отвез домой.","Спокойствие, эмпатия","Сочувствие, поддержка, альтруизм","Респондент предпочитает ненавязчивую помощь, что отражает современные тенденции к уважению личных границ и индивидуальности.",эпизод,,,,
11,Молодая взрослость,Ощущение одиночества,"Респондент признает, что иногда испытывает чувство одиночества, несмотря на активный образ жизни и общение с людьми, и отмечает желание делиться жизнью с кем-то близким.","Конечно, бывает. Все-таки человеку нужен человек, и пускай моя работа, естественно, связана с людьми, я веду активный образ жизни и так далее. Конечно, хочется найти то самое, да, и получать свое удовольствие от жизни, наслаждаться не одному в этом доме, да, всем тем, что у меня есть.","Легкая грусть, откровенность","Потребность в близости, искренность","Ощущение одиночества характерно для молодых взрослых, даже при наличии социальных связей, и связано с поиском значимых отношений.",декларация,,,True,
12,Молодая взрослость,Здоровье и образ жизни,"Респондент оценивает свой образ жизни как умеренный, отмечая наличие здоровых привычек, дисциплину в питании, но признает, что курит после еды.","Я все-таки курю, вот поэтому умеренный. Хоть я и курю, но у меня есть четкое ограничение.","Самокритика, реализм","Умеренность, самодисциплина, забота о здоровье","Респондент демонстрирует осознанное отношение к здоровью, сочетая здоровые привычки с некоторыми компромиссами.",декларация,,,,
1,"Взрослая жизнь, рефлексия о прошлом",Ключевой негативный опыт (первый ночлег),"Респондент сожалеет о некоем первом ночлеге, который повлиял на его жизненный путь. Он считает, что если бы не этот эпизод, его жизнь могла бы сложиться иначе.","За исключением первого ночлега, Евгений, меня все устраивает. Если возможно, я бы, конечно, его убрал. Может быть, я бы сейчас не общался с вами, а был бы где-нибудь высоко, и вы бы обо мне слышали.","Сожаление, легкая грусть","Рефлексия, стремление к лучшему, принятие прошлого","Респондент склонен анализировать свою биографию через призму отдельных событий, придавая им судьбоносное значение. Это типичная стратегия осмысления жизненного пути в условиях неопределенности.",перелом,,1.0,,
2,Настоящее время,Физическое здоровье и отношение к медицине,"Респондент оценивает свое физическое здоровье на 10 из 10, редко болеет, предпочитает самолечение витаминами и обращается к врачу-другу только в крайних случаях. К официальной и нетрадиционной медицине относится с осторожностью, предпочитает минимальное вмешательство.","Я очень редко болею. И если я болею, я лечусь своими витаминами... К традиционной медицине я пробегаю только в крайних ситуациях.","Уверенность, спокойствие","Самостоятельность, рациональность, недоверие к системе",Демонстрируется типичная для молодых взрослых установка на самостоятельное управление здоровьем и скепсис по отношению к официальным институтам.,декларация,,1.0,,"минимальное участие (самолечение, частные клиники при необходимости)"
3,Настоящее время,Критика российского медицинского образования и системы,"Респондент негативно оценивает состояние российской медицины, связывает это с низким качеством образования и халатностью студентов и врачей. Приводит в пример более строгие западные стандарты.","Я знаю таких людей, медиков, которые учились. Я знаю, как они недобросовестно относились к участию в направлении хирурга. Я искренне стараюсь, желаю вам не попасть под их нож.","Разочарование, тревога","Профессионализм, ответственность, уважение к труду",Критика системы образования и медицины отражает распространенное недоверие к государственным институтам и идеализацию западных стандартов.,декларация,российская система образования и здравоохранения,1.0,,
4,Настоящее время,Образ друга-врача и профессиональная страсть,"Респондент восхищается своим другом, который работает врачом и проявляет исключительную преданность профессии, не уезжает за границу из моральных соображений.","Он живет своей работой, в буквальном смысле... Я говорю ему, что ты за границу планируешь? Нет, говорит, я останусь здесь. Я, говорит, хочу своим примером показать.","Восхищение, уважение","Профессионализм, преданность, моральный выбор","Респондент противопоставляет индивидуальные примеры профессионализма общей картине системы, подчеркивая роль личной ответственности.",эпизод,медицинское сообщество,1.0,,
5,Настоящее время,Опыт обращения в медучреждения и отношение к вакцинации,"Респондент предпочитает частные клиники, если не может получить помощь от друга-врача. К вакцинации относится скептически, воспринимает ее как вынужденную меру.","Без вакцины меня бы не пустили на пару. Это единственное моё отношение. То есть, ну, такое принудительное вакцинирование под лозунгом добровольного.","Скепсис, ирония","Свобода выбора, прагматизм",Скепсис к массовым медицинским практикам и предпочтение частных услуг характерны для людей с опытом разочарования в государственных институтах.,декларация,,1.0,,"частные клиники, вакцинация по необходимости"
6,Взрослая жизнь,Негативный опыт медицинской помощи,"Респондент вспоминает случай некачественной медицинской помощи при операции на пальце, но спустя время относится к этому с юмором.","Я, терпя боли в движении, начал смеяться сквозь слезы. Бабушка-старушка едала тут затыльника, выгнала с отдела второго оболтуса.","Юмор, ирония, ретроспективное принятие","Стойкость, умение смеяться над трудностями","Даже негативный опыт осмысляется через юмор, что может быть защитным механизмом и способом дистанцирования от травматичных событий.",эпизод,государственная медицина,1.0,,
7,Настоящее время,Эмоциональное состояние и отношение к психологии,"Респондент не испытывает тревожности или подавленности, не обращался за психологической помощью, но считает психическое здоровье очень важным.","Если человеку действительно необходимо, то я считаю, что это необходимо, все-таки психическое состояние, оно было гораздо погубнее, чем физическое.","Спокойствие, рациональность","Психологическое здоровье, эмпатия","Отражает растущее признание важности психического здоровья, несмотря на отсутствие личного опыта обращения к специалистам.",декларация,,1.0,,
