id,life_stage,theme,summary,quote,emotion,values,sociological_note,type,institution,housing_promised,market_participation,collapse_context,digital_literacy
3,Зрелый возраст,Питание и пищевые привычки,"Респондентка безразлична к еде, но при этом ценит эстетическую сторону подачи пищи. Для неё важно, чтобы еда была красиво сервирована, даже если это простые продукты.","Мне нужно, чтобы были салфетки, мне нужно, чтобы картошка была красивым веером, мне нужно, чтобы салатик был разложен, как должно. Вот этому я... Чтобы колбаска ливерная была порезана ровным колечком.","Лёгкая ирония, спокойствие","Эстетика, порядок, самоуважение",Важность эстетики в быту может быть способом поддержания чувства контроля и самоуважения в условиях ограниченных ресурсов или сниженной социальной активности.,эпизод,,,,True,
4,Зрелый возраст,Образ жизни и желания изменений,"Респондентка хотела бы изменить многие аспекты своего образа жизни, включая питание, физическую активность, режим дня. Она осознаёт разницу между тем, что хочет разум и что хочет тело.","Мне бы очень хотелось бы вставать рано. Я периодически это делаю, но не переживайте. Мне бы хотелось выгнать график работы и денег. Мне бы хотелось непременно выходить, прогуляться вечером перед сном.","Сожаление, усталость, лёгкая надежда","Структурированность, здоровье, самодисциплина","Желание изменений и признание трудностей в их реализации характерны для людей, испытывающих возрастные ограничения и внутренние конфликты между привычками и стремлением к лучшему.",декларация,,,,True,
5,Зрелый возраст,Психологическое состояние и саморефлексия,"Респондентка отмечает склонность к самокопанию, жалости к себе, что негативно влияет на её эмоциональное состояние. Она недовольна собой, иногда испытывает тревожность и подавленность.","Паническое настроение. Я очень люблю себе копаться, себя жалеть. В итоге я делаю много для себя. Ничем это выражается.","Тревожность, подавленность, самокритика","Саморефлексия, честность с собой","Высокий уровень саморефлексии и склонность к самокритике могут быть следствием социальной изоляции, возрастных изменений и недостатка внешней поддержки.",декларация,,,,True,
6,Зрелый возраст,Медицинские практики и отношение к медицине,"Респондентка принимает лекарства от хронических заболеваний, доверяет официальной медицине, но критикует современную систему за бюрократию и недостаток индивидуального подхода. Отмечает важность человеческого фактора при выборе врача.","Медицина в целом, это хорошо, я не против официальной медицины, я не против фармакологии, я обеим руками сам, потому что травмами буквально не все вылечишь. А вот медицина, которая есть в деятельности сейчас, нет.","Критика, разочарование, рациональность","Рациональность, доверие к науке, индивидуальный подход","Критика современной медицины и бюрократии отражает общий тренд среди пожилых людей, сталкивающихся с недостатком внимания и формализмом в государственных учреждениях.",декларация,Государственные и частные клиники,,Ограниченное участие из-за финансовых возможностей,True,
7,Зрелый возраст,Опыт обращения за медицинской помощью,"Респондентка обращается как в государственные, так и в частные клиники, но отмечает, что полное обследование и лечение в частных учреждениях ей не по карману. Иногда сталкивалась с некачественной медицинской помощью.","Если счёт честного переклинивания так, как мне бы хотелось, вот с полным обследованием, с полным лечением, то есть это мне не по карману.","Разочарование, принятие","Здоровье, профессионализм, доступность","Финансовые ограничения влияют на выбор медицинских услуг, что типично для пожилых людей с фиксированным доходом. Оценка качества медицины строится на личном опыте и человеческом факторе.",эпизод,Государственные и частные клиники,,Ограниченное,True,
8,Зрелый возраст,Отношение к вакцинации,"Респондентка положительно относится к вакцинации, делала прививку от ковида, но не считает нужным делать прививки без необходимости.","Ну, сейчас у меня нет необходимости, но я бы и так помогла Маку от ковида. То есть я бы сделала клипы перед этим.","Рациональность, спокойствие","Здравый смысл, ответственность","Прагматичный подход к вакцинации характерен для людей, доверяющих официальной медицине, но не склонных к избыточной профилактике.",декларация,,,,True,
9,Зрелый возраст,Психологическое благополучие и отношение к психологической помощи,"Респондентка положительно относится к психологической помощи, хотя сама не обращалась, но видит пользу по отзывам знакомых. Открыта к новым формам поддержки.","положительно у меня есть знакомая Я просто вижу отзывы, которые пишут ей люди. Нет, ну а и что? Конечно, важно.","Открытость, спокойствие","Психологическое здоровье, поддержка","Положительное отношение к психологической помощи среди пожилых людей становится всё более распространённым, хотя личный опыт обращения пока редок.",декларация,,,,True,
10,Зрелый возраст,Забота о здоровье близких и опыт ухода,"Респондентка переживает за здоровье близких, пытается мотивировать их на обследования, но сталкивается с их сопротивлением. Имеет опыт ухода за человеком, активирует социальные связи для помощи.","Я могу постоянно внушать. А мне тут застыть, чего вы компенсируете?... Поэтому я на всякий случай подстраховалась и активировала всех знакомых, кого знаю. Но вытащили.","Тревога, забота, бессилие","Забота, ответственность, поддержка","Забота о близких и опыт ухода типичны для женщин зрелого возраста, часто берущих на себя роль координатора семейного благополучия.",эпизод,,,,True,
11,Зрелый возраст,Ожидания относительно будущего и заботы о себе,"Респондентка задумывается о будущем, тревожится о возможной необходимости ухода, надеется на помощь детей, но не уверена в их готовности.","Ну, дети, может быть, сидят, по-моему, на цветах, не дают ждать.","Тревога, неуверенность, надежда","Безопасность, поддержка, семейные связи","Ожидание поддержки от детей и тревога по поводу будущего ухода типичны для пожилых людей, особенно женщин, в условиях недостаточно развитой системы социальной поддержки.",декларация,,Ожидание помощи от детей,,True,
1,"Зрелый возраст, пенсионный период",Забота о близких и эмоциональное выгорание,"Респондентка испытывает чувство вины и бессилия из-за невозможности помочь близким, несмотря на готовность следовать медицинским рекомендациям. Её забота о других сопряжена с внутренним конфликтом и усталостью.","Для меня в этом теме важно только одно, что я ничего не могу сделать для своих близких... Для меня сложно, и очень утомительно постоянно из малого тянуть ноги.","Усталость, фрустрация, вина","Забота о семье, ответственность, самопожертвование","Типичная для пожилых женщин ситуация, когда забота о близких становится источником эмоционального выгорания. Респондентка ощущает давление социальных ожиданий и внутренний конфликт между желанием помочь и невозможностью изменить ситуацию.",узел,,,,True,
2,Пенсионный возраст,Финансовое положение и стратегия расходов,"Респондентка отмечает нехватку пенсии и зарплаты, вынуждена экономить, основные расходы — медицина, жильё, подарки близким. Нет привычки тратить много, избегает крупных покупок и кредитов.",Мне не всегда хватает моей пенсии и моих зарплат... У нас основные деньги не хватили на больницу.,"Огорчение, сдержанность","Бережливость, ответственность, забота о здоровье","Финансовые ограничения типичны для пенсионеров, особенно женщин. Приоритет — базовые нужды и поддержка близких. Отсутствие привычки к крупным тратам и осторожность в финансовых решениях отражают опыт жизни в условиях дефицита.",эпизод,,,низкая,True,
3,Вся взрослая жизнь,Потребительское поведение и отношение к покупкам,"Респондентка не совершает спонтанных покупок, не пользуется маркетплейсами из-за технических сложностей, предпочитает покупать только необходимое, выбирает недорогие товары, не гонится за новизной.","Нет привычки, широко тратить деньги... У меня не получилось, но я понял, да.","Сдержанность, равнодушие к потребительским трендам","Рациональность, экономность, простота",Поколенческая дистанция в цифровых сервисах и недоверие к новым форматам торговли. Привычка к экономии и рациональному потреблению — результат жизненного опыта в условиях ограниченных ресурсов.,декларация,,,очень низкая,True,
4,Современный этап жизни,Отношение к собственности и крупным покупкам,"Респондентка не владеет собственностью, это её осознанное решение. Крупные покупки совершаются редко, только по необходимости, предпочтение отдаётся недорогим и практичным вещам.","В собственности нет ничего. У меня в собственности нет ничего. Это, это, это, это мое решение.","Спокойствие, принятие","Независимость, минимализм, практичность","Отказ от собственности может быть связан с личными убеждениями или семейными обстоятельствами. Такая позиция редка для старшего поколения, где владение жильём и имуществом традиционно считалось важным.",декларация,отсутствие частной собственности,,,True,
5,Пенсионный возраст,Доходы и расходы семьи,"Доходы семьи состоят из пенсии и зарплаты, суммы невелики (15-25 тыс. руб. в месяц). Бюджет не общий, расходы обсуждаются только при крупных тратах, планирования нет.","То есть мои, да? Если постоянная одна пенсия, то получается порядка 15 тысяч... у него свой, у вас свой получается То есть он не общий этот бюджет получается, да? Да.","Реализм, некоторая неудовлетворённость","Прозрачность, самостоятельность, честность","Раздельный бюджет в пожилой семье — нечастое явление, отражающее индивидуализм и, возможно, особенности семейной истории. Отсутствие чёткого планирования может приводить к финансовым трудностям.",эпизод,,,,True,
6,Вся взрослая жизнь,Отношение к образованию,"Респондентка выступает за бесплатное образование, считает, что платное не даёт преимуществ, а доступ к знаниям должен быть равным.","Отряд начинался, конечно, бесплатно... Препараты те же самые. Все те же самые. Только бесплатный человек сможет пройти на бюджет, а платного он не сможет.","Убеждённость, принципиальность","Равенство, доступность образования",Позиция отражает советские ценности и недоверие к коммерциализации образования. Для старшего поколения бесплатное образование — важный социальный институт.,декларация,бесплатное образование,,,True,
7,Пенсионный возраст,Взаимодействие с государственными структурами,"Респондентка негативно относится к государственным органам, избегает обращения за перерасчётом пенсии из-за страха унижения и бюрократии.","Я уже давно выяснила, что мне неправильно платить на пенсии... Я не могу, я не хочу, меня не лезет. Мне больше вот это унижение, я не знаю, смогу ли я его перенести.","Раздражение, бессилие, разочарование","Достоинство, независимость","Недоверие к государству и страх перед бюрократией характерны для людей, сталкивающихся с неэффективностью и формализмом госструктур. Это снижает готовность защищать свои права.",узел,"пенсионный фонд, госорганы",,,True,
8,Пенсионный возраст,Гендерные роли и труд,"Респондентка придерживается патриархальных взглядов на распределение финансовых обязанностей, но признаёт, что в современной жизни женщины часто вынуждены работать и обеспечивать семью.","У меня в этом плане патриархальный господь, конечно, должен зарабатывать мучком... Мне бы хотелось, чтобы меня кто-то обеспечивал, а я тут нет, поэтому непригодна оказалась.","Сожаление, ностальгия, принятие","Традиционализм, семейственность, трудолюбие","Конфликт между традиционными гендерными установками и современной реальностью, где женщины часто становятся основными добытчиками. Респондентка испытывает внутренний разрыв между желаемым и действительным.",декларация,,,,True,
1,зрелый возраст,Взаимодействие с государственными сервисами и бюрократией,"Респондент делится опытом использования мобильного приложения для государственных услуг, отмечая его ограниченную функциональность и неудовлетворенность качеством обслуживания в государственных учреждениях.","Мобильное приложение Мой Новый прекрасно установлено. Ну, опять же, оно настолько полукосое, что там ничего, кроме какого-то графика, я не посмотрю, не попросить, не узнаю.","раздражение, усталость","эффективность, доступность информации, уважение к гражданам","Опыт респондента отражает типичное недоверие и разочарование в цифровизации и бюрократических процедурах, характерное для старшего поколения, сталкивающегося с недостатками госуслуг.",эпизод,"государственные сервисы, МФЦ, мобильные приложения",,,,
2,зрелый возраст,Оформление документов и взаимодействие с чиновниками,"Респондент рассказывает о сложностях при оформлении и замене паспорта, потере документов и необходимости предоставлять дополнительные справки, что зависит от отношения начальства.","Если я не нравлюсь начальнику, то бы мне паспорт не дали.","разочарование, бессилие","справедливость, прозрачность процедур","Взаимодействие с чиновниками воспринимается как зависимость от личных отношений и субъективных факторов, что подрывает доверие к институтам.",эпизод,"паспортный стол, органы регистрации",,,,
3,зрелый возраст,Взаимодействие с налоговой службой,"Респондент описывает свой опыт с налоговой, отмечая путаницу в обязанностях работодателя и собственных, а также необходимость разбираться в вопросах самостоятельно.","Я только опомнилась на пункте, как правильно чек составлять, что вообще можно составлять.","растерянность, самостоятельность","ответственность, финансовая грамотность","Проблемы с налоговой часто связаны с недостатком информации и поддержки, что вынуждает граждан самостоятельно разбираться в сложных вопросах.",эпизод,налоговая служба,,налогоплательщик,,
4,зрелый возраст,Опыт столкновения с полицией и преступностью,"Респондент рассказывает о случаях кражи и взаимодействии с полицией, отмечая формальный подход сотрудников и отсутствие реальной помощи.","У нас будет дело не раскрытое, а как же это будет? То есть у нас решение. Ну, то есть, да, по-моему, закончилось. Вы понимаете, что мы никого не найдем?","разочарование, апатия","безопасность, честность","Недоверие к полиции и ощущение формальности процедур характерны для многих граждан, что снижает уровень обращения за помощью.",эпизод,полиция,,,,
