id,life_stage,theme,summary,quote,emotion,values,sociological_note,type,institution,collapse_context,housing_promised,market_participation,location_preference
11,"Зрелость, ретроспектива",Оценка жизненного пути и принятие прошлого,"Респондент не жалеет о пройденном пути, считает, что именно он сформировал её ценность как личности.","Нет. Я с годами понимаю собственную ценность, именно пройдя тот путь, который я прошла.","Принятие, благодарность","Самоценность, опыт",Принятие прошлого и отсутствие сожалений — признак зрелой идентичности и внутренней гармонии.,декларация,,1.0,,,
12,"Детство, травматический опыт",Переживание смерти отца и влияние на личность,"В детстве респондент пережила смерть отца, что стало травматическим опытом и долгое время влияло на её внутренний мир.","Отец умер в постели со мной, и эта смерть была, это прям, ну... От этого я избавлялась в определенные вещи.","Грусть, боль, рефлексия","Семья, память, преодоление","Травматический опыт в детстве оказывает длительное влияние на личность, формирует отношение к жизни и смерти, влияет на выбор партнёров и эмоциональную сферу.",узел,,1.0,,,
13,"Настоящее, зрелость",Восприятие смерти и силы воли,"Респондент размышляет о смерти, приводит пример подруги, которая борется с онкологией, отмечает силу воли и переоценку ценностей в таких ситуациях.","У нее четвертая стадия саркома. Она живет уже в ремиссии четвертый год. Это, наверное, то чудо, когда сила... желание, ну, наверное, побеждает либо отсрачивает всё.","Восхищение, уважение, переоценка","Сила духа, желание жить, переосмысление ценностей",Личные истории борьбы с болезнью становятся для респондента источником вдохновения и переосмысления жизненных приоритетов.,эпизод,"Онкологический центр «Песочная», Санкт-Петербург",1.0,,,
14,"Настоящее, завершение интервью",Рефлексия по поводу интервью и открытость,"Респондент отмечает комфорт и открытость в беседе, готовность обсуждать даже интимные темы, благодарит интервьюера.","Есть очень мало тем, которые для меня на текущий момент дискомфортны. Даже если бы вы полезли в очень интимное, я бы рассказала.","Доверие, благодарность","Открытость, искренность",Высокий уровень доверия к интервьюеру и готовность к самораскрытию свидетельствуют о сформированной идентичности и психологической зрелости.,декларация,,1.0,,,
1,"Завершение интервью, рефлексия над опытом участия",Оценка интервью и его структуры,"Респондент отмечает, что интервью было составлено интересно и охватило практически все сферы жизни, кроме интимных. Подчеркивает широту охвата и благодарит за участие.","И здесь было затронуто, в принципе, все сферы жизни. Ну, практически. Конечно, здесь еще есть сферы жизни, которые не были затронуты. Это, как вы сказали, интимные.","Благодарность, удовлетворение, интерес","Открытость, широта взглядов, признание важности разных сфер жизни","Респондент демонстрирует рефлексивность и способность оценивать исследовательский процесс, что говорит о высоком уровне вовлеченности и осознанности.",декларация,,1.0,,,
2,Профессиональная саморефлексия,Профессиональное общение и вовлечение,"Респондент размышляет о своем профессиональном опыте общения с незнакомыми людьми, отмечая, что вовлечение в моменте и профессиональный интерес делают длительное интервью незаметным по времени.","Профессионально у меня скорее общение с совершенно незнакомым человеком, вовлечение в моменте. Ну, это просто моя мысль в голове.","Профессиональный интерес, спокойствие","Профессионализм, вовлеченность, открытость новому опыту","Отражает важность профессиональных навыков коммуникации и умения находить интерес в новых контактах, что может быть характерно для представителей определённых профессий (например, HR, психология, исследовательская деятельность).",декларация,,1.0,,,
3,Рефлексия над значимостью человеческих контактов,Важность общения и эмоционального контакта,"Респондент подчеркивает значимость опыта общения с разными людьми, отмечает эмоциональный контакт, возникший в ходе интервью, и благодарит за доверие.","Да, и опыт общения с людьми, он вообще колоссально важен, для меня важен вообще в принципе. Это опыт с разными людьми.","Теплота, благодарность, удовлетворение","Человеческое общение, эмоциональная близость, доверие","Демонстрирует ценность межличностных связей и эмоционального обмена, что может быть связано с личностными особенностями или профессиональной деятельностью, ориентированной на людей.",декларация,,1.0,,,
4,Городская идентичность и культурные предпочтения,Связь с городом и культурными местами,"Респондент упоминает значимые для себя места — Санкт-Петербург, Кронштадт, Молодежный театр на Фонтанке, советует их посетить, подчеркивая их важность для личной идентичности.","И очень рада, что вот так получилось, что здесь были затронуты мои моменты такие, и Санкт-Петербург, и Кронштадт. ... Молодежка это must have. Вот вы меня вспомните.","Гордость, радость, энтузиазм","Культурная принадлежность, любовь к городу, эстетические предпочтения",Указывает на формирование городской идентичности и значимость культурных пространств как элементов самоидентификации.,эпизод,Молодежный театр на Фонтанке,1.0,,,
005,Философская рефлексия,Случайности и судьба,"Респондент выражает убеждение, что в жизни ничего не бывает случайно, подчеркивая значимость каждого события.","В этой жизни ничего случайного не бывает, Вероника.","Уверенность, философское принятие","Судьба, осмысленность происходящего","Отражает экзистенциальную установку, свойственную людям, склонным к рефлексии и поиску смысла в событиях жизни.",декларация,,1.0,,,
