id,life_stage,theme,summary,quote,emotion,values,sociological_note,type,institution,housing_promised,market_participation,collapse_context
17,"Настоящее время, семейная жизнь",Смысл денег,"Деньги воспринимаются как свобода выбора и возможности, а не только как источник напряжения.","Наверное, деньги в нашем случае – это свобода, свобода выбора, свобода пользования, допустим, какими-то благами цивилизации...","оптимизм, мечтательность","свобода, возможности","Деньги — инструмент расширения жизненных горизонтов, а не самоцель.",декларация,,,,True
18,"Настоящее время, семейная жизнь",Отношение к богатству и работе,"Даже при гипотетическом выигрыше крупной суммы респондент не уверен, что бросил бы работу, считая, что деньги не вечны.","Любые деньги, будь то халявные или нет, за они все равно рано или поздно кончатся. И, соответственно, работать все равно надо.","реализм, умеренный скепсис","трудолюбие, ответственность","Работа воспринимается как неотъемлемая часть жизни, даже при наличии финансовой независимости.",декларация,,,,True
19,"Настоящее время, семейная жизнь",Финансовые цели и инфляция,"В условиях инфляции и политической нестабильности семья не ставит глобальных целей по накоплению, главная задача — не залезть в долги.","Видя нашу инфляцию, которая съедает большую часть накоплений... наша пока задача не залезть в долги.","тревога, осторожность",финансовая безопасность,"Экономическая нестабильность влияет на стратегию семьи, смещая акцент с накоплений на выживание.",декларация,,,,True
20,"Настоящее время, семейная жизнь",Опыт взаимодействия с государственными органами,"Обращения в госорганы воспринимаются как вынужденная необходимость, к которой стараются не прибегать без острой нужды.","Ассоциации... Ну, как вынуждена необходимость. Не знаю, как то, что мы без большой нужды стараемся не делать.","отстранённость, формальность","самостоятельность, минимизация контактов с бюрократией","Недоверие и дистанция по отношению к государственным институтам, характерные для многих россиян.",декларация,государственные органы,,,True
21,"Взрослая жизнь, отдельные случаи",Опыт обращения в полицию,"Респондент дважды обращался в полицию: при краже и при обнаружении тела. Опыт оценивает как формальный, но корректный.","Полицейские, на мой взгляд, поступили корректно, по уставу, по этикету... Но так как-то это было сделано больше к формальному подходу.","нейтральность, лёгкая отчуждённость","справедливость, формальность","Взаимодействие с полицией воспринимается как формальная процедура, без личного участия со стороны сотрудников.",эпизод,полиция,,,True
22,"Взрослая жизнь, отдельные случаи",Опыт обращения в суд,"Супруга респондента обращалась в суд по поводу затопления квартиры, чтобы добиться компенсации.","По-моему, в суд у меня обращалась супруга, но это было связано не с ней, а по поводу затопления квартиры...","деловитость, прагматизм","справедливость, защита собственности","Суд используется как инструмент защиты имущественных интересов, при необходимости.",эпизод,суд,True,,True
1,"Взрослая жизнь, решение юридических вопросов",Взаимодействие с судебной системой и исполнительными органами,"Респондент описывает опыт получения судебного решения в свою пользу и последующие трудности с исполнением решения и получением возмещения через исполнительный лист. Процесс затянулся на три года, органы действовали формально.","Мы довольны тем, что мы получили решение суда в нашу пользу... Но так как это исполнялось, что мы потом с этим исполнительным листом бегали... выясняли, что он не работает официально, что с него взять практически нечего.","Умеренное разочарование, усталость, некоторая удовлетворенность результатом","Справедливость, законность, формальное исполнение обязанностей","Опыт респондента иллюстрирует типичную ситуацию с исполнением судебных решений в России: формальное исполнение, затяжные сроки, низкая эффективность взыскания с неофициально работающих должников.",эпизод,"Суд, УФСИН, исполнительная служба",False,False,
2,"Юность, переход к взрослой жизни",Воинская обязанность и здоровье,Респондент не служил в армии по состоянию здоровья: хроническая бессонница и проблемы с сердцем привели к получению категории годности 'С' и 'белого билета'.,"Нет, так вышло, что я не попал по здоровью... Это то, что я рассказывал про вот эту, как называется, бессонницу... В сердечной линии у меня тоже нашли пролапс клапана...","Спокойствие, легкая отстраненность","Здоровье, принятие обстоятельств","Случай респондента отражает распространенную практику освобождения от службы по медицинским показаниям, а также демонстрирует отношение к воинской обязанности как к формальности, зависящей от состояния здоровья.",эпизод,"Военкомат, медицинская комиссия",,False,
3,"Взрослая жизнь, оформление документов и жилья","Бюрократические процедуры: жилье, права, прописка","Респондент вспоминает опыт оформления документов на жилье и водительских прав. Отмечает, что процесс был формализован, но не вызывал особых сложностей.","Я просто застал то время, когда еще выдавались эти сертификаты на жилье в виде бумажного такого документа... Все было проделано по тем этапам, которые расписаны. У меня не было тогда сложностей.","Нейтральность, удовлетворенность","Порядок, следование процедурам","Респондент демонстрирует адаптацию к бюрократическим процедурам и отсутствие критики по отношению к ним, что характерно для людей, привыкших к формализованным государственным сервисам.",эпизод,"Госуслуги, ГИБДД, жилищные органы",True,False,
4,Взрослая жизнь,Доверие к государственным органам,"Респондент оценивает свое доверие к государственным органам как среднее, отмечая, что не имел большого опыта взаимодействия с ними, кроме полиции, судов и санитарных служб.","Ну, наверное, средние. Просто я, наверное, не так уж много общался с органами настолько, чтобы оценить их на такие критические минимумы, максимумы.","Сдержанность, умеренность","Объективность, осторожность в суждениях","Средний уровень доверия к государственным органам типичен для респондентов с ограниченным опытом взаимодействия, что снижает как позитивные, так и негативные оценки.",декларация,"Полиция, суд, санэпидемстанция",,False,
5,Взрослая жизнь,Оценка социальной политики государства,"Респондент отмечает, что государство делает многое для детей и пенсионеров, особенно военных, но считает, что в сфере медицины и обеспечения жильем поддержки недостаточно.","Мое мнение, что наше государство много чего делает для детей... Но, наверное, все равно, с точки зрения медицины, это недостаточно.","Умеренная критика, реализм","Социальная справедливость, забота о слабых",Респондент разделяет распространенное мнение о приоритетах социальной политики и указывает на проблемы в здравоохранении и жилищном обеспечении.,декларация,"Социальные службы, пенсионный фонд",,False,
6,Взрослая жизнь,Отношение к государственным монополиям,"Респондент считает монополию РЖД скорее минусом, но лично не сталкивался с проблемами. В сфере ЖКХ и энергетики также не испытывает серьезных нареканий.","Ну, наверное, что РЖД монополист, это, наверное, скорее минус... но у меня, скажем так, вот пока мы путешествовали с супругой, у меня таких проблем не было.","Нейтральность, прагматизм","Практичность, отсутствие идеологических предубеждений","Личный опыт респондента влияет на восприятие эффективности монополий, несмотря на общее критическое отношение к монополизации.",декларация,"РЖД, ЖКХ, энергетика",,True,
7,Взрослая жизнь,Понимание устройства власти и отношение к ней,"Респондент демонстрирует базовое знание структуры власти (законодательная, исполнительная, судебная), отмечает необходимость госслужбы и выражает лояльное отношение.","Ну, зная, что власть делится на законодательную, исполнительную и судебную... госслужба это та вещь, которой так или иначе она должен кто-то заниматься.","Спокойствие, лояльность","Порядок, государственность",Респондент воспроизводит школьные знания о власти и демонстрирует умеренно лояльную гражданскую позицию.,декларация,Государственная власть,,False,
8,Взрослая жизнь,Оценка работы региональной и федеральной власти,"Респондент затрудняется дать оценку в целом, но отмечает проблемы с доступностью медицинских услуг на региональном уровне (долгая очередь к врачам-специалистам).","Я попал к врачу через 8 месяцев после своего первого приступа, связанного с нажатием пищевода. Я считаю, что это ненормально.","Недовольство, критика","Доступность медицины, эффективность госуслуг","Критика здравоохранения — типичный мотив в оценках региональной власти, особенно в части доступности специалистов.",эпизод,"Региональная власть, поликлиника",,False,
9,Взрослая жизнь,Обсуждение политики в повседневной жизни,"Политика обсуждается с коллегами только в связи с рабочими вопросами (например, закрытие дорог), общая политика и коррупционные скандалы обсуждаются редко и эпизодически.","Мы с коллегами в основном обсуждаем то, что связано по работе... если когда-то касается общей политики... это так, как бы от случая к случаю происходит.","Безразличие, прагматизм","Практичность, профессионализм","Политика воспринимается как далекая от повседневных забот, обсуждается только в связи с непосредственными интересами.",декларация,Рабочий коллектив,,True,
10,Взрослая жизнь,Гражданская субъектность и отношение к политике,"Респондент не верит в возможность влиять на политику страны, ощущает себя способным влиять только на локальные вопросы (например, благоустройство двора).","Я знаю, что могу повлиять на чистоту и обустройство кустарников в своем дворе. Я сомневаюсь, что я могу что-то делать в области глобальной политики.","Пессимизм, смирение","Реализм, локальная активность","Типичная для современной России позиция ограниченной гражданской субъектности, фокус на локальных инициативах.",декларация,Местное самоуправление,,False,
11,"Взрослая жизнь, период СВО",Влияние СВО на жизнь и отношение к ней,"Респондент негативно относится к СВО, отмечает экономические последствия для своей работы (рост цен, перебои с поставками, неопределенность), выражает сочувствие участникам.","Ну, вы знаете, как снабженец, вагист, я отношусь к этому отрицательно. Потому что у нас после того, как после 24 февраля 2022 года у нас начали резко скакать цены...","Боль, досада, сочувствие","Стабильность, гуманизм, экономическая безопасность","Экономические последствия СВО воспринимаются как личная угроза, что формирует негативное отношение к политике государства.",перелом,"Рабочее место, рынок",,True,
12,Взрослая жизнь,Участие в выборах,"Респондент обычно участвует в выборах, если находится по месту регистрации.","Ну, как правило, да. Если ничего не мешает, если я нахожусь на своем по месту регистрации, то, как правило, да, участвую.","Спокойствие, формальность","Гражданский долг, формальное участие","Участие в выборах воспринимается как рутинная обязанность, без выраженного энтузиазма.",декларация,Избирательная комиссия,,False,
13,Взрослая жизнь,Отношение к распределению бюджетных средств,"Респондент не имеет четкой позиции по поводу справедливости распределения бюджета, отмечает абстрактность и непрозрачность процесса.","Такой вопрос настолько абстрактный, настолько от меня далекий.","Безразличие, дистанция","Скептицизм, осторожность",Недоверие и дистанция к вопросам макроэкономики и бюджетной политики типичны для обывателя.,декларация,Государственный бюджет,,False,
14,Взрослая жизнь,Отношение к внутренней и внешней политике России,"Респондент считает, что Россия пытается играть роль сверхдержавы, что выглядит нелепо из-за продолжающихся экономических связей с недружественными странами. Внутренняя политика оценивается положительно в части поддержки ветеранов и семей, но отмечается необходимость контроля миграции.","Россия пытается играть свою роль сверхдержавы... Просто делаем это через... левые схемы, получается, через перекупку, через нескольких дилеров и поставщиков.","Ирония, критика, умеренное одобрение","Прагматизм, социальная поддержка, безопасность",Респондент демонстрирует критическое отношение к внешней политике и прагматичный взгляд на внутренние меры поддержки.,декларация,"Государство, внешнеэкономические связи",,True,
15,Взрослая жизнь,Потребление новостей и информационных технологий,"Респондент получает новости через телевизор и интернет, преимущественно через Яндекс.Дзен, не проявляет высокой вовлеченности в политическую повестку.","Я периодически, когда смотрю погоду утром и иногда смотрю новости вечером, в основном через телевизор или через интернет узнаю, часто через приложение «Яндекс. Дзен».","Нейтральность, умеренный интерес","Информированность, технологическая адаптация","Преобладание пассивного потребления новостей характерно для широкой аудитории, не вовлеченной в политическую жизнь.",декларация,Медиа,,False,
16,Взрослая жизнь,Использование цифровых технологий и соцсетей,"Респондент считает себя знакомым с соцсетями и искусственным интеллектом, использует ВКонтакте, Одноклассники, Telegram для общения, работы и получения информации.","Ну, я знаю, что это такое некоторыми соцсетями, типа пользователь... ВКонтакте пользуюсь часто. Одноклассниками в последнее время от случая к случаю... Telegram... у меня есть ветка Telegram, там есть я подписан на пару интересных сообществ.","Уверенность, спокойствие","Технологическая грамотность, профессионализм","Респондент демонстрирует типичный для зрелого пользователя паттерн: использование соцсетей преимущественно для коммуникации и работы, а не для развлечения.",декларация,"Социальные сети, мессенджеры",,True,
1,"Молодость, ранняя зрелость",Опыт онлайн-знакомств,"Респондент вспоминает свой опыт использования сайтов знакомств, отмечая, что пробовал знакомиться через МАМБу и Знакомства Mail.ru, но считает интернет-знакомства в целом некачественными и разочаровывающими.","Ай, интернет-знакомство — это, по сути, помойка, где много людей, много неадекватов, много человек, которые приходят не с теми целями, с которыми они заявили.","Разочарование, скепсис","Открытость к новому опыту, но критичность, ценность искренности","Опыт онлайн-знакомств воспринимается как неудачный и не соответствующий ожиданиям, что типично для части пользователей старших возрастных когорт, для которых традиционные формы знакомства более предпочтительны.",эпизод,,,"Пробовал онлайн-знакомства, но не интегрировался в рынок онлайн-дейтинга",
