id,life_stage,theme,summary,quote,emotion,values,sociological_note,type,institution,housing_promised,market_participation,collapse_context
11,Зрелость,Мотивация к военной службе,"Основные мотивы — экономическая необходимость (погашение кредитов), желание проверить себя, а также патриотизм.","Во-первых, экономическая составляющая тоже была актуальна... Ну и больше хотел, честно говоря, проверить себя... Если бы не было чувства патриотизма, я бы, наверное, даже бы и не пошел.","Решимость, самоирония, патриотизм","Самопроверка, долг, материальная ответственность","Мотивация к службе складывается из сочетания экономических обстоятельств, личных вызовов и патриотических чувств, что типично для зрелых мужчин в условиях экономической нестабильности.",декларация,военная служба,,контрактная служба,True
1,"служба в Росгвардии, период СВО",Бытовые условия и питание на службе,"Респондент описывает бытовые условия и организацию питания во время службы в Росгвардии в зоне СВО. Отмечает, что структура гибкая, питание организовано хорошо, но бывают сложности с горячей едой и баней.","С питанием вообще все отлично. С питанием вообще все хорошо, питание поступает вовремя. Но если нет возможности горячего питания, с сухими пайками как-то всё это идёт...","спокойствие, принятие, легкая усталость","терпение, адаптация, коллективизм","Респондент демонстрирует адаптацию к сложным условиям, подчеркивает важность терпения и коллективной поддержки. Описывает типичные для военной службы бытовые трудности и способы их преодоления.",эпизод,Росгвардия,0.0,False,
2,вступление в брак,Семейная жизнь и значимость даты,"Респондент рассказывает о вступлении в официальный брак, выборе особенной даты и связанных с этим воспоминаниях.","В брак я вступил в такую дату 12. 12. 2012. Специально выбрали. За полтора месяца пришли, так сказать, в ЗАГС, чтобы эту дату заполучить.","гордость, радость, легкая ирония","семья, традиции, память о важных событиях",Выбор даты и связанные с этим истории иллюстрируют важность символических моментов и ритуалов в семейной жизни. Подчеркивается ценность официального брака.,эпизод,ЗАГС,0.0,False,
3,"семейная жизнь, рождение ребенка",Влияние рождения сына на приоритеты,"Рождение сына изменило приоритеты респондента, появились новые заботы и необходимость жертвовать личными расходами ради нужд ребенка.","Приходится какие-то траты уже в чем-то себе отказать. Отправить ребенка на какие-то нужды, на лечение, в зависимости от ситуации.","ответственность, забота","семья, забота о детях, ответственность","Рождение ребенка становится переломным моментом, меняющим структуру расходов и систему ценностей. Демонстрируется типичная для российского общества установка на жертвенность ради детей.",перелом,семья,0.0,False,
4,"развитие отношений, семейная жизнь",Значимые отношения и конфликты,"Респондент отмечает, что в жизни были значимые отношения, периоды ссоры и примирения, что считает нормальным процессом. Подчеркивает важность решения конфликтов.","В жизни нет такого, что все гладко. Все равно с переменами возникает какое-то недопонимание, которое нужно как-то тихонько решить.","реализм, принятие","коммуникация, терпимость, работа над отношениями",Отношение к конфликтам как к естественной части жизни отражает зрелый взгляд на отношения и важность эмоционального интеллекта.,декларация,семья,0.0,False,
5,"профессиональная деятельность (МЧС, Росгвардия)",Стрессоустойчивость и поведение в экстремальных ситуациях,"Респондент рассказывает о работе в МЧС, умении справляться со стрессом, мобилизации в сложных ситуациях и наблюдении за реакциями других людей.","Я же все-таки в МЧС работал... самое главное успокоиться, принять это, а потом уже можно проанализировать.","уверенность, спокойствие","самоконтроль, профессионализм, ответственность",Опыт работы в экстренных службах формирует особую стрессоустойчивость и способность к быстрой мобилизации. Подчеркивается отличие от менее подготовленных людей.,узел,"МЧС, Росгвардия",0.0,False,
6,"служба в зоне СВО, Мариуполь",Распорядок дня и условия службы,"Описывается типичный распорядок дня на службе, особенности казарменного положения, совместное проживание, конфликты из-за скученности, а также изменения после отмены казарменного положения.","До этого, до прошлого года, до 17 мая, мы были, получается, была зона специальной военной операции, Мы находились на казарменном положении, жили в казарме. Ну как в казарме? Бывшее здание разрушенной больницы...","усталость, адаптация, облегчение","дисциплина, коллективизм, адаптация","Жизнь в условиях военной службы требует высокой адаптивности и терпимости к бытовым неудобствам. Совместное проживание усиливает коллективные связи, но порождает конфликты.",эпизод,Росгвардия,0.0,False,
7,"служба в Мариуполе, период СВО",Взаимоотношения с местным населением,"Респондент отмечает, что население Мариуполя неоднородно по отношению к военным, часть лояльна, часть — нет, что связано с разрушением города и потерей имущества.","В Майуполе там достаточно недружелюбное население. Да? Конечно. И поэтому там население такое, не сказать, что пока еще сильно лояльное. Но их можно понять. У них уничтожили город фактически...","понимание, сочувствие, осторожность","справедливость, эмпатия, безопасность","Респондент демонстрирует понимание причин недоверия и враждебности со стороны местных жителей, что говорит о рефлексии и эмпатии к пострадавшим.",декларация,Росгвардия,0.0,False,
8,"служба, отпуск, обучение",Учеба в магистратуре и саморазвитие,"Респондент учится в магистратуре по программе «Время героев», использует учебные отпуска для образования, отмечает поддержку таких инициатив.","На магистратуре я учусь... если сейчас учусь я по программе «Президентское время героев», тоже как бы есть такая программа...","удовлетворение, интерес","саморазвитие, образование, карьерный рост","Военные и государственные программы поощряют дополнительное образование, что способствует профессиональному и личностному росту участников СВО.",эпизод,"магистратура, программа «Время героев»",0.0,False,
9,"служба, отпуск",Отдых и способы восстановления,"Респондент рассказывает о способах отдыха: прогулки на море, чтение, просмотр фильмов, общение с товарищами. Отмечает важность психологической разгрузки.",Перед психологической разгрузкой на море хожу.,"усталость, стремление к восстановлению","психологическое здоровье, дружба, баланс","В условиях стресса и напряжения военной службы респонденты ищут способы восстановления, часто используя природу и общение как ресурс.",эпизод,Росгвардия,0.0,False,
10,гражданская жизнь до СВО,Обыденная жизнь и досуг до СВО,"До начала СВО жизнь респондента была типичной: работа в будни, отдых и развлечения в выходные, поездки в торговые центры, дача.","Ну, все как обычно, как у всех.","нейтральность, легкая ностальгия","стабильность, семейные традиции, трудолюбие","Жизнь до СВО воспринимается как более предсказуемая и стабильная, с типичными для среднего класса паттернами досуга и потребления.",декларация,,0.0,True,
11,"гражданская жизнь, семья",Распределение домашних обязанностей и ремонт,"В семье обязанности распределяются по договоренности, респондент выполняет мелкий ремонт, сложные работы доверяет специалистам. Вспоминает семейные традиции, связанные с ремонтом.","Мы по-разному как-то договариваемся, что-то делаем, допустим.","спокойствие, практичность","партнерство, рациональность, семейные традиции","Современная семья склонна к гибкому распределению обязанностей, часть работ делегируется профессионалам. Вспоминаются традиции старших поколений.",эпизод,семья,0.0,True,
12,"гражданская жизнь, семья",Домашние животные и отношение к ним,"В семье есть кошка-сфинкс, взятая из приюта, и собака. Кошка воспринимается как мудрое и понимающее существо.",Кошка более спокойная. Кошка-сфинкс. Ух ты! Ее из приюта забрали. Она уже была взрослая особь.,"теплота, привязанность","забота о животных, эмпатия",Отношение к животным как к полноправным членам семьи отражает современные ценности городской семьи.,эпизод,семья,0.0,False,
13,"служба, отпуск",Связь с семьей во время службы,"Респондент поддерживает связь с семьей через Telegram, избегает других каналов из соображений безопасности.",По телеграмму общаемся. По другим источникам и каналам не рекомендовано общаться.,"осторожность, забота","безопасность, семейные связи","Военные реалии диктуют ограничения на коммуникацию, что влияет на поддержание семейных связей и эмоциональное состояние.",эпизод,Росгвардия,0.0,False,
14,"настоящее время, служба",Значимость близких и круг общения,"Респондент выделяет в круге близких жену и сына, остальные — знакомые разной степени близости. Бабушка и дедушка умерли.","Из близких у меня, соответственно, сын, жена. Все остальные это кто-то из знакомых.","спокойствие, легкая грусть","семья, близкие отношения","Семья занимает центральное место в системе социальных связей, остальные отношения воспринимаются как менее значимые.",декларация,семья,0.0,False,
1,"Взрослая жизнь, зрелость",Отношения с матерью,"Респондент рассказывает об изменениях в отношениях с матерью, подчеркивает разницу поколений и взглядов, отмечает редкие встречи из-за проживания в разных городах, связь поддерживается по телефону.","То есть мама, она живет вообще в другом городе, то есть она редко к нам приезжает. Так, созваниваемся по телефону, то есть у нее там какие-то свои, вот свое какое-то видение...","спокойствие, принятие","уважение к родителям, принятие различий, семейные связи",Дистанция между поколениями и географическая разобщенность типичны для современных российских семей; поддержание связи преимущественно дистанционно.,эпизод,семья,,,True
2,"Взрослая жизнь, зрелость",Семейные традиции и конфликты,"В семье респондента были материальные конфликты и разногласия по воспитанию ребенка, но серьезных конфликтов не было. Традиции ограничиваются празднованием дней рождения и поездками на море, которые сейчас прекратились.","Конфликты были материальные. В основном же из-за материального конфликтов были... Конфликты по воспитанию ребенка. Не конфликты, скорее всего, должны быть конфликты.","нейтральность, легкая усталость","стабильность, семейное согласие, материальное благополучие",Материальные вопросы и воспитание детей — частые источники напряжения в российских семьях. Традиции становятся менее устойчивыми из-за изменений в образе жизни.,эпизод,,,,True
3,"Взрослая жизнь, зрелость",Отношения с супругой,"Респондент ценит в отношениях с женой взаимопонимание, партнерство и способность договариваться. Отмечает различие интересов, но подчеркивает стратегическое партнерство.","У нас какое-то партнерство идет. Как-то так получается. Правильно это или нет, я, честно говоря, даже не знаю. Но пока такой период. Такого стратегического партнерства.","удовлетворение, спокойствие","партнерство, взаимопонимание, уважение","Современные браки часто строятся на партнерстве и равноправии, что отражает сдвиг от традиционных патриархальных моделей.",декларация,,,,True
4,"Взрослая жизнь, зрелость",Финансовые отношения в семье,"Бюджет в семье совместный, но респондент придерживается правила иметь 'заначку', чему его научила бабушка. Крупные покупки обсуждаются, мелкие — на усмотрение жены.","Мне еще бабушка научила, что жене никогда не нужно все деньги отдавать. Тебе должна быть заначка.","ирония, легкая улыбка","финансовая самостоятельность, семейная традиция, осторожность","Сочетание совместного бюджета и личных накоплений — типичная практика для российских семей, отражающая недоверие к полной открытости в финансовых вопросах.",эпизод,,,,True
5,"Взрослая жизнь, зрелость",Профессиональная деятельность супругов,"Профессиональные интересы супругов не пересекаются. Жена — детский массажист, респондент помогал ей в обучении во время пандемии.","Она детский массажист. Она массажи деткам делала. Закончила медицинский колледж. Собственно, я ей помогал в обучении.","поддержка, забота","взаимопомощь, поддержка, образование","Пандемия усилила взаимную поддержку в семьях, особенно в вопросах образования и профессионального развития.",эпизод,,,,True
6,"Взрослая жизнь, зрелость",Родительство и отношения с сыном,"Появление сына изменило отношения в семье, основное воспитание на жене, респондент работает на нескольких работах. С сыном есть совместные занятия (баня, бассейн), отношения ровные, конфликты минимальны.","Потому что сын – это новый член семьи, на которого нужно уделить внимание, свою любовь, материали. Это же не кошка с собакой.","ответственность, забота","семья, забота о детях, ответственность","Традиционное распределение ролей: мать — основной воспитатель, отец — добытчик, но при этом старается участвовать в жизни ребенка.",эпизод,,,,True
7,"Взрослая жизнь, зрелость",Дружба и социальные связи,"Друзей детства не осталось из-за частых переездов. Основные контакты — коллеги по службе, особенно из МЧС. Общение строится на совместном решении задач, конфликты старается избегать.","Детства у меня уже сейчас нет, потому что я очень много переезжал. С кем я общался, они уже выросли и в другом городе живут.","легкая грусть, принятие","профессиональная солидарность, адаптация, избегание конфликтов","Мобильность и смена мест жительства приводят к размыванию детских связей, а профессиональные контакты становятся основой социальной поддержки.",эпизод,,,,True
8,"Взрослая жизнь, зрелость",Одиночество и доверие,"Респондент не испытывает одиночества из-за постоянного нахождения среди людей на работе. Доверяет супруге, чувствует себя социально включенным.",Там постоянно ты находишься 24 на 7 с людьми. Там вообще нет одиночества.,"уверенность, спокойствие","социальная включенность, доверие","Плотный рабочий график и коллективная работа компенсируют недостаток близких друзей, снижая чувство одиночества.",декларация,,,,True
9,"Взрослая жизнь, зрелость",Здоровье и отношение к нему,"Респондент не уделяет особого внимания здоровью, но регулярно сдает кровь как донор, что позволяет контролировать состояние. Беспокоят только зубы и возрастные изменения.",Я вообще сам являюсь донором. У меня на сегодняшний день 20 дней уже кровосдачи.,"спокойствие, легкая гордость","альтруизм, здоровье, невозмутимость",Донорство — проявление социальной ответственности; регулярные медицинские проверки становятся частью образа жизни.,декларация,,,донорство,True
