id,life_stage,theme,summary,quote,emotion,values,sociological_note,type,institution,housing_promised,market_participation,collapse_context
4,Взрослая жизнь,Стратегии поведения в конфликтных ситуациях с родственниками,"Респондент предпочитает деликатность и уважение в сложных ситуациях с пожилыми родственниками, не пытается их менять.","Я решил, что не буду как-то на это влиять. Перестроить человека, которому сейчас седьмой десяток, бесполезно.","спокойствие, зрелость","уважение к старшим, деликатность, принятие",Стратегия ненасильственного взаимодействия с пожилыми родственниками отражает зрелую позицию и уважение к возрасту.,декларация,,,,
5,Взрослая жизнь,Ощущение одиночества и изоляции,"Респондент временами чувствует одиночество, особенно когда сталкивается с проблемами, которые никто не может решить, кроме него самого. В остальное время предпочитает уединение во время болезни.","Бывают случаи тоже, когда себя чувствуешь немного одиноко... когда что-то не клеится, что-то не родители, не супруги тебе не могут помочь с проблемами на работе.","легкая грусть, рефлексия","самостоятельность, личное пространство, принятие трудностей","Ощущение одиночества связано не с отсутствием окружения, а с ответственностью за собственные проблемы. Это типично для зрелого возраста и самостоятельных людей.",декларация,,,,
6,Подростковый возраст,Проблемы со здоровьем в детстве и подростковом возрасте,"В подростковом возрасте респондент страдал бессонницей, проходил лечение снотворными. Также часто лежал в больнице по разным причинам (аппендицит, грыжи, ячмени, пищевые отравления).","В 15-16 лет у меня были проблемы с бессонницей... В детстве переболел практически всем, что было у ребенка.","нейтральность, легкая усталость","здоровье, доверие к родителям, принятие обстоятельств","Частые болезни и госпитализации в детстве формируют особое отношение к здоровью и медицинской системе, а также доверие к мнению взрослых.",эпизод,,,,
7,Взрослая жизнь,Отношение к здоровью и медицинской системе,"Респондент осознал важность прислушиваться к своему организму и обращаться к врачам при необходимости. Критически оценивает решения родителей в детстве, отмечает отсутствие альтернативных медицинских консультаций в прошлом.","Я сейчас пришел к тому выводу, что надо здоровье желательно прислушиваться к своему организму. Это важно.","осознанность, критичность","самостоятельность, ответственность, информированность",Переход от пассивного следования советам взрослых к самостоятельному принятию решений о здоровье характерен для зрелого возраста.,перелом,,,,
8,Взрослая жизнь,Хронические и возрастные проблемы со здоровьем,"С возрастом появились ограничения по здоровью: грыжа позвоночника, грыжа пищевода, сужение сосудов. Приходится соблюдать ограничения в питании и физической активности.",Это уже ограничение на здоровье... То есть ты вынужден жить уже подстраиваясь под свои капризы организма.,"смирение, легкая тревога","здоровье, адаптация, дисциплина",Возрастные изменения здоровья требуют адаптации образа жизни и формируют новые практики самоконтроля.,узел,,,,
9,Взрослая жизнь,Питание и вредные привычки,"Респондент старается соблюдать диету, но отмечает трудности из-за корпоративных традиций. Не курит, алкоголь употребляет редко, в основном по праздникам.","Сладкого тоже сказали, сбегать. Но как вот на работе, два-двадцать сотрудников в отделе, празднуем дни рождения, скидываемся на дни рождения, получаем по куску тортика.","ирония, самоирония","дисциплина, умеренность, социальная адаптация",Корпоративная культура и социальные ритуалы могут мешать индивидуальным стратегиям заботы о здоровье.,эпизод,,,,
10,Взрослая жизнь,Отношение к официальной медицине и опыт обращения,"В целом доверяет официальной медицине, но отмечает необходимость самостоятельного поиска информации и дополнительных консультаций, особенно при сложных случаях (на примере болезни супруги).","Я к ней отношусь с доверием, вот, и считаю, что, в принципе, ее мнению надо прислушиваться. Одновременно я вот понял... что у нас очень большая проблема.","доверие, критичность, разочарование","информированность, ответственность, забота о близких","Рост самостоятельности пациентов и критичности к системе здравоохранения — тренд последних лет, особенно при хронических и редких заболеваниях.",узел,здравоохранение,,,
11,Взрослая жизнь,Финансовые затраты на здоровье,"Лечение супруги потребовало значительных расходов на анализы, поездки, проживание в других городах. Это ощутимо для семейного бюджета.",В итоге все выходит просто в такую круглую сумму. Ощутимо для семейного бюджета.,"разочарование, усталость","забота о семье, финансовая ответственность",Рост доли платных медицинских услуг и связанных с ними расходов становится значимой проблемой для семей среднего класса.,эпизод,,,True,
12,Взрослая жизнь,Профилактика и корпоративная забота о здоровье,"На предприятии организуют диспансеризацию сотрудников, что респондент оценивает положительно. Сам обращается к врачам в основном по необходимости.","Я считаю, что это классная, кстати, забота сотрудников.","одобрение, благодарность","забота о сотрудниках, профилактика",Корпоративные инициативы по профилактике здоровья воспринимаются как важный элемент социальной поддержки.,эпизод,работодатель,,,
13,Взрослая жизнь,Стресс и эмоциональное состояние,"Респондент сталкивается со стрессом на работе и в семье (болезнь супруги, травма ребенка). Эмоциональное состояние зависит от внешних обстоятельств, но в целом справляется с трудностями.","Был стресс, когда ребенок... сломал себе позвонок... Был стресс, когда у супруги был приступ... Это был тоже дикий стресс.","тревога, усталость, облегчение","стойкость, забота о близких, ответственность","Стрессовые ситуации в семье и на работе — часть повседневности взрослого человека, требующая эмоциональной устойчивости.",эпизод,,,,
1,"Взрослая жизнь, трудоустройство",Обращение к психологу и психотерапевту,"Респондент сталкивался с психологами и психотерапевтами только в рамках обязательных медосмотров при трудоустройстве и получении водительских прав, а не по собственной инициативе.","Это было не по моей нужде, а потому что была служебная необходимость.",нейтрально-отстранённый,"рациональность, выполнение обязательств","Видна типичная для мужчин установка на самостоятельное преодоление трудностей и обращение к специалистам только по необходимости, а не по внутренней потребности.",эпизод,"медицинские учреждения, трудоустройство",,,True
2,"Взрослая жизнь, рефлексия",Отношение к психологической помощи,"Респондент считает, что обращаться к психологу нужно, но сам этого не делает, отмечая, что мужчинам свойственно скрывать свои переживания.","Наверное, надо бы обращаться к психологу чаще, а не только, когда, так сказать, припрёт... Просто мужчинам еще как-то свойственно скрывать все, держать все в себе.","самокритика, лёгкая рефлексия","самостоятельность, сдержанность, традиционные гендерные роли",Демонстрируется внутренний конфликт между осознанием пользы психологической помощи и культурными стереотипами о мужской сдержанности.,декларация,,,,True
3,"Настоящее время, семейная жизнь",Здоровье и самочувствие,"Респондент отмечает проблемы со здоровьем, связанные с состоянием супруги, что влияет на его концентрацию и усталость.","С супруги, потому что она жалует, что меня периодически качает... Чувствую себя рассеянным, у меня пропадает концентрация внимания, я чувствую себя сильнее, устаю.","беспокойство, усталость","забота о семье, здоровье","Здоровье воспринимается как семейная проблема, влияющая на качество жизни и финансовое положение.",эпизод,,,,True
4,"Настоящее время, семейная жизнь",Финансовое положение семьи,"Семья живёт на среднем уровне: хватает на основные нужды, но не на крупные покупки или поездки за границу.","Нам бы хватает денег на покупку простой бытовой техники, на одежду, на обеспечение основных нужд, потребностей. Но там такое, как заграничную поездку или новый автомобиль с нуля, мы бы, наверное, не могли себе позволить.","умеренное удовлетворение, реализм","достаточность, рациональность",Позиция «среднего класса» с акцентом на базовые потребности и ограниченные возможности для роскоши.,декларация,,,"покупка бытовой техники, одежды, базовых товаров",True
5,"Настоящее время, семейная жизнь",Источники дохода и сбережения,"Основные доходы — зарплаты и небольшие вклады под проценты. Были попытки инвестирования на бирже, но это не стало постоянным источником дохода.",В основном это наши зарплаты плюс вклады. Один небольшой у меня и у супруги. Вклады под проценты.,"спокойствие, прагматизм","стабильность, осторожность","Семья использует традиционные и относительно безопасные финансовые инструменты, с осторожным отношением к риску.",декларация,,,"банковские вклады, краткосрочные инвестиции",True
6,"Настоящее время, семейная жизнь",Структура расходов и приоритеты,"Основные расходы — питание, одежда, медицина, нужды ребёнка. На этих статьях экономить не готовы, особенно на питании и лекарствах.","Не готовы экономить, но это, наверное, питание, здоровое питание, раз... Лекарства, необходимые лекарства.","уверенность, забота","здоровье, забота о семье, качество жизни",Расходы на здоровье и питание воспринимаются как жизненно необходимые и не подлежащие сокращению.,декларация,,,,True
7,"Настоящее время, семейная жизнь",Покупательское поведение и спонтанные покупки,"Респондент старается избегать спонтанных покупок, но иногда покупает вещи для отца в секонд-хенде, руководствуясь практичностью.","Если я вижу хорошие рубашки, которых нет у отца... Я в итоге принимал решение за отца, чтобы купить какую-то вещь ему, которая мне понравилась.","забота, лёгкая неуверенность","практичность, забота о близких",Покупки для других членов семьи — проявление заботы и рационального подхода к потреблению.,эпизод,,,секонд-хенд,True
8,"Настоящее время, семейная жизнь",Покупки на маркетплейсах,"Семья регулярно покупает товары для дома и сада на маркетплейсах, но одежду предпочитает приобретать офлайн.","Покупаем, но большей частью не вещи... В основном это была электроника и что-то для гарда, для сада, для дома.",удовлетворение,"удобство, функциональность","Маркетплейсы используются как удобный канал для приобретения специализированных товаров, но не для одежды.",декларация,,,маркетплейсы,True
9,"Настоящее время, семейная жизнь",Отношение к новым и подержанным вещам,"Респондент готов покупать подержанные вещи, если они функциональны и в хорошем состоянии, особенно в секонд-хенде.","Я так как бы смотрю, что вещи можно взять и подержанную, если она функциональна, если она неплохо выглядит и работоспособная.",прагматизм,"рациональность, экономия",Готовность к покупке подержанных вещей свидетельствует о прагматичном отношении к потреблению.,декларация,,,секонд-хенд,True
10,"Взрослая жизнь, семейная жизнь",Опыт кредитования,"Семья брала кредит на покупку квартиры и иногда пользуется картой рассрочки для оплаты коммунальных услуг, быстро гасит задолженность.","Помимо покупки нашей квартиры в кредит... Ещё я пользуюсь Карта Халва, например, тоже считается как кредитная карта, карта рассрочки...",контролируемое отношение к долгам,"финансовая дисциплина, ответственность","Кредиты используются только по необходимости, с акцентом на быструю выплату и минимизацию долговой нагрузки.",эпизод,,True,,True
11,"Взрослая жизнь, попытки самореализации",Опыт инвестирования,"Респондент пробовал торговать акциями через брокерский счёт, но не рассматривает это как серьёзный источник дохода.","Я пробовал торговать акциями на нашей бирже ММВБ. Я не назвал бы это источником дохода, просто, скажем так, я попробовал...","любопытство, умеренное разочарование","саморазвитие, осторожность","Попытка освоить новые финансовые инструменты, но с осторожным выводом о рисках и нестабильности.",эпизод,,,фондовый рынок,True
12,"Настоящее время, семейная жизнь",Покупки продуктов и отношение к процессу,"Покупка продуктов воспринимается как обязанность, но иногда приносит удовольствие, особенно если покупается что-то приятное для семьи.","Понятно, что это в каком-то плане обязанность, а в каком-то плане... когда покупаешь что-то сладкое для себя, для ребёнка, наверное, испытываешь какое-то эстетическое удовольствие.",нейтрально-позитивный,"забота о семье, бытовая стабильность","Потребление продуктов — часть семейной рутины, но может быть источником небольших радостей.",декларация,,,продуктовые магазины,True
13,"Настоящее время, семейная жизнь",Питание вне дома и полуфабрикаты,"Семья редко пользуется доставкой еды и редко питается вне дома, но периодически покупает полуфабрикаты.","С доставкой практически кроме, по-моему, отдельного заказа суши, по-моему, мы ей более не пользовались. Нет.",нейтрально-прагматичный,"экономия, домашний уклад","Преобладает домашнее питание, полуфабрикаты используются как компромисс между удобством и экономией.",декларация,,,полуфабрикаты,True
14,"Настоящее время, семейная жизнь",Сбережения и финансовые трудности,"Семья старается откладывать деньги, но крупные траты на лечение или стоматологию могут полностью съесть накопления.","Когда предстоят какие-то крупные траты, вот как, например, поездки на лечение... мы ни копейки не смогли отложить, даже наоборот, вынуждены были залезть в бюджет.","беспокойство, реализм","финансовая безопасность, здоровье","Здоровье — основной фактор риска для семейного бюджета, сбережения нестабильны.",эпизод,,,,True
15,"Взрослая жизнь, образование",Платное и бесплатное образование,"Респондент и его ребёнок пользовались платными образовательными услугами (курсы, кружки), но выбор между платным и бесплатным зависит от качества.","Если, скажем так, бесплатный устраивает по качеству, по набору услуг, то, наверное, бы остановились на нем.",рациональность,"качество образования, прагматизм",Платные услуги рассматриваются как вынужденная мера при недостаточном качестве бесплатных.,декларация,образовательные учреждения,,,True
16,"Настоящее время, семейная жизнь",Гендерные роли и семейный бюджет,"В семье были споры о том, кто должен обеспечивать, но пришли к выводу, что в их ситуации работать должны оба супруга.","В нашей ситуации, у нас пока нет такой возможности... работать надо всем, и это без вариантов.","примирение, реализм","равенство, адаптация к обстоятельствам","Гибкое отношение к традиционным ролям, адаптация к экономическим реалиям.",узел,,,,True
