id,life_stage,theme,summary,quote,emotion,values,sociological_note,type,institution,housing_promised,market_participation,collapse_context,digital_literacy
5,Настоящее время,Покупки и предпочтения,"Респондентка предпочитает покупать новые вещи, не доверяет подержанным товарам, делает покупки в супермаркетах, редко пользуется доставкой.","Я предпочитаю малое. Так как у меня всегда добросовестные предательства, даже на клещи.","Недоверие, осторожность","Чистота, надежность, привычка к самостоятельности","Недоверие к подержанным вещам и предпочтение самостоятельных покупок отражают ценности поколения, выросшего в условиях дефицита и необходимости беречь вещи.",декларация,,,средняя,True,
6,"Пенсионный возраст, последние годы",Собственность и имущественные вопросы,"У респондентки нет собственности на жилье или автомобиль, это ее осознанное решение.","У меня в собственности нет ничего. Это, это, это, это мое решение.","Спокойствие, принятие","Свобода от материальных обязательств, самостоятельность","Отказ от собственности может быть связан с личными убеждениями или семейными обстоятельствами, что нехарактерно для большинства представителей поколения.",декларация,отсутствие частной собственности,,,True,
7,Пенсионный возраст,Доходы и бюджет,"Основной доход — пенсия, сумма порядка 14-15 тысяч рублей в месяц, летом чуть меньше из-за отсутствия компенсации за отопление. Доходы нестабильны.","Если постоянная одна пенсия, то получается порядка 15 тысяч. То есть зимой это порядка 15 тысяч, а летом это 14 тысяч.","Сдержанность, реализм","Адаптация к обстоятельствам, честность","Низкий и нестабильный доход типичен для пенсионеров, особенно женщин, что влияет на уровень жизни и потребительское поведение.",эпизод,,,,True,
8,Вся взрослая жизнь,Отношение к образованию,"Респондентка получила высшее образование бесплатно, считает платное образование менее справедливым, предпочла бы бесплатное для своих близких.","Отряд начинался, конечно, бесплатно... Препараты те же самые. Все те же самые. Только бесплатный человек сможет пройти на бюджет, а платного он не сможет.","Убежденность, принципиальность","Справедливость, равенство возможностей",Установка на бесплатное образование отражает советские ценности и недоверие к коммерциализации социальной сферы.,декларация,бесплатное высшее образование,,,True,
9,Настоящее время,Семейный бюджет и финансовые решения,"В семье нет общего бюджета, расходы и доходы разделены, крупные траты оплачиваются по ситуации, нет строгого планирования.","У нас нет такого школы, как у меня было... В течение моего четкого трата нет рамок, поэтому...","Небольшое недовольство, принятие","Автономия, гибкость",Раздельный бюджет и отсутствие финансового планирования могут быть следствием индивидуализации семейных отношений в зрелом возрасте.,эпизод,,,,True,
10,Настоящее время,Гендерные роли и труд,"Респондентка придерживается патриархальных взглядов на распределение ролей в семье, но признает, что в современной жизни женщины часто зарабатывают больше.","У меня в этом плане патриархальный господь, конечно, должен зарабатывать мучком... Но у меня такого нет.","Смешанные чувства, ностальгия, принятие изменений","Традиционализм, адаптация","Сочетание традиционных и современных взглядов на гендерные роли характерно для женщин старшего поколения, сталкивающихся с изменениями в обществе.",декларация,,,,True,
11,Настоящее время,Отношение к деньгам и финансовым целям,"Деньги ассоциируются со свободой выбора, желаемый доход для семьи — около 100 тысяч рублей в месяц.","Деньги — это свобода выбора... Я думаю... Ну, наверное, 100 тысяч в месяц платили.","Мечтательность, реализм","Свобода, комфорт","Финансовые ожидания респондентки отражают стремление к стабильности и независимости, несмотря на текущие ограничения.",декларация,,,,True,
12,Настоящее время,Взаимодействие с государственными структурами,"Респондентка негативно относится к государственным учреждениям, избегает обращения за перерасчетом пенсии из-за чувства унижения и неудобства.","Я уже давно выяснила, что мне неправильно платить на пенсии... Мне больше вот это унижение, я не знаю, смогу ли я его перенести.","Раздражение, обида, усталость","Достоинство, независимость","Недоверие к государственным институтам и избегание бюрократических процедур типичны для людей, имеющих негативный опыт взаимодействия с ними.",эпизод,"пенсионный фонд, государственные органы",,,True,
1,зрелый возраст,Взаимодействие с государственными сервисами и бюрократией,"Респондент рассказывает о своем опыте взаимодействия с государственными структурами: мобильные приложения, оформление документов, очереди, потеря документов, необходимость предоставления характеристик с работы. Испытывает разочарование и усталость от неэффективности и формализма.","Нет такого, как вот пришел, попал, сделал, что нужно, ушел. Этого никогда не было.","раздражение, усталость, разочарование","эффективность, прозрачность, уважение к человеку","Опыт респондента типичен для людей, сталкивающихся с российской бюрократией: формализм, отсутствие клиентоориентированности, низкая информированность сотрудников. Это формирует недоверие к институтам и ощущение беспомощности.",эпизод,"госуслуги, паспортный стол, мобильные приложения",,,,
2,зрелый возраст,Опыт взаимодействия с налоговой и работодателем,"Респондент описывает трудности с пониманием налоговой системы, неуверенность в действиях работодателя, необходимость самостоятельного контроля за уплатой налогов.","Я только опомнилась на пункте, как правильно чек составлять, что вообще можно составлять. Я думаю, что работодатель не знает, что это все оплачено.","неуверенность, настороженность","ответственность, самостоятельность",Недостаточная прозрачность налоговой системы и слабая информированность граждан о своих правах и обязанностях характерны для постсоветского пространства. Респондент вынужден самостоятельно разбираться в сложных вопросах.,эпизод,"налоговая инспекция, работодатель",,частичное,,
3,зрелый возраст,Столкновения с полицией и потеря имущества,"Респондент дважды сталкивалась с кражей сумки и обращением в полицию, отмечает формальный подход сотрудников, отсутствие реальной помощи и нежелание обращаться в дальнейшем.","У нас будет дело не раскрытое, а как же это будет? То есть у нас решение. Ну, то есть, да, по-моему, закончилось. Вы понимаете, что мы никого не найдем?","разочарование, апатия","справедливость, безопасность",Недоверие к правоохранительным органам и ощущение их неэффективности приводит к снижению гражданской активности и отказу от обращения за помощью.,эпизод,полиция,,,,
4,зрелый возраст,Опыт столкновения с мошенничеством,"Респондент упоминает случай мошенничества, но не стала обращаться в полицию, ссылаясь на недоверие и усталость от формализма.","Но с этим я не стала обращаться, ничего, потому что, опять же...","апатия, недоверие","самостоятельность, осторожность","Растущее недоверие к институтам приводит к тому, что граждане предпочитают не обращаться за защитой своих прав.",эпизод,полиция,,,,
5,"семейная жизнь, зрелый возраст",Семейные судебные процессы,"Респондент упоминает о судебном процессе, связанном с наследством после смерти отца.",Было ли у вас раздумение дома после книги отца в интервью? Угу.,"спокойствие, принятие","семья, справедливость","Семейные судебные процессы часто становятся источником стресса, но респондент говорит о них спокойно, что может свидетельствовать о принятии неизбежности подобных ситуаций.",эпизод,суд,,,,
6,семейная жизнь,Служба в армии родственников,"Респондент сообщает, что сын и второй муж проходили службу в армии, выражает мнение о необходимости контрактной службы.","Я считаю, что оно должно быть удобнее.","нейтральность, рациональность","долг, рациональность","Отношение к службе в армии становится более прагматичным, поддерживается идея контрактной службы как более современной и эффективной.",декларация,армия,,,,
7,зрелый возраст,Отношение к государству и его функциям,"Респондент рассуждает о функциях государства, отмечает его роль в социальной и защитной сферах, но выражает сомнения в эффективности реализации этих функций.","Государство, у него функция заложена, естественно, на середину, это и социальная сфера, и круговая сфера.","сомнение, критичность","социальная справедливость, защита","Респондент демонстрирует понимание теоретических функций государства, но отмечает разрыв между декларируемыми задачами и реальностью.",декларация,государство,,,,
8,зрелый возраст,Власть и общество: структура и отношение,"Респондент рассуждает о природе власти, ее дисциплинирующей функции, отмечает отдаленность власти от общества и необходимость большей ориентированности на людей.","Власть, она должна быть. Она дисциплинирует общество. Я считаю так.","рефлексия, критичность","порядок, справедливость","Респондент осознает важность власти для поддержания порядка, но отмечает недостаточную связь между властью и обществом.",декларация,власть,,,,
9,зрелый возраст,Оценка работы региональной и федеральной власти,"Респондент критикует региональную власть за отсутствие заботы и неэффективность, отмечает формальный подход к решению проблем, приводит пример с очистными сооружениями.","Нет заботы. Нет, нет, нет, нет, нет, нет, нет, нет.","разочарование, критика","забота, ответственность","Недовольство региональной властью связано с ощущением отстраненности и формализма, что типично для провинциальных городов.",декларация,"региональная власть, федеральная власть",,,,
10,зрелый возраст,Отношение к политическим институтам и их функциям,"Респондент демонстрирует базовое понимание структуры федеральной власти, отмечает важность законодательной работы, но не проявляет особого интереса к деталям.",Правительство принимает решение по значимым вопросам для государства. Федеральное собрание это Законодательная работа.,"нейтральность, дистанция","структурированность, порядок","Респондент не вовлечен в детали политической жизни, что характерно для большинства граждан, не связанных с политикой напрямую.",декларация,"правительство, федеральное собрание",,,,
11,зрелый возраст,Отношение к политике и политической активности,"Респондент отмечает, что политика влияет на жизнь, но предпочитает дистанцироваться от нее, обсуждения с близкими редки, интерес к новостям умеренный.","Я понимаю, что политика, она все время имеет влияние на мою жизнь. Ну, мне бы хотелось бы, чтобы ты не подал, чтобы я не подморщил тебя.","усталость, дистанция","личное пространство, независимость","Политическая апатия и усталость от постоянного информационного давления характерны для зрелых граждан, переживших периоды политической турбулентности.",декларация,,,,,
12,зрелый возраст,Доверие к СМИ и восприятие информации,"Респондент скептически относится к объективности СМИ, отмечает, что одна и та же информация может подаваться по-разному, что затрудняет формирование собственного мнения.","Слышно и понятно, как меняется континент одного и того же события, разновидные одни и те же.","скепсис, недоверие","критическое мышление, самостоятельность",Скепсис по отношению к СМИ характерен для людей с опытом жизни в условиях пропаганды и информационных манипуляций.,декларация,СМИ,,,,
13,зрелый возраст,Отношение к внешней политике России,"Респондент затрудняется оценить внешнюю политику, но отмечает, что России свойственно добиваться своего, и это ей импонирует.","Мне это нравится, потому что в России считают слишком долго уклоняясь, прогибаясь, пытаясь трудиться.","гордость, осторожный оптимизм","самостоятельность, национальная гордость","Патриотические нотки и одобрение самостоятельной внешней политики характерны для части населения, уставшей от внешнего давления.",декларация,государство,,,,
14,зрелый возраст,Восприятие места России в мире и отношения других стран,"Респондент считает, что Россия занимает третье место в мире, отмечает влияние пропаганды на отношение других стран, подчеркивает притягательность России.",Потому что Россия действительно страна притягательная.,"гордость, уверенность","патриотизм, национальная идентичность",Восприятие России как великой державы и вера в ее привлекательность для других стран типичны для патриотически настроенных граждан.,декларация,государство,,,,
15,зрелый возраст,Оценка внутренней политики и выборов,"Респондент считает, что правильное направление внутренней политики — развитие, а неправильное — отсутствие контроля. Отказывается участвовать в выборах, считая их формальностью.",Уже не хожу. Давно не ходите?,"разочарование, апатия","развитие, контроль, честность",Отказ от участия в выборах и скепсис по отношению к политическим процессам отражают кризис доверия к институтам представительной демократии.,декларация,выборы,,,,
1,"Зрелость, активная профессиональная и семейная жизнь",Отношение к государственным институтам и монополиям,"Респондент рассуждает о роли государства, эффективности монополий, справедливости распределения бюджетных средств и коррупции. Выражает доверие к государственным институтам и считает, что коррупция — явление другого уровня, с которым лично не сталкивался.",Потому что от монополии государственной нет ничего плохого. Потому что государственная от него влияет и там.,"Спокойствие, рациональность","Доверие к государству, справедливость, законность","Респондент демонстрирует типичное для старшего поколения доверие к государственным институтам и скепсис по отношению к частным структурам. Коррупция воспринимается как нечто далёкое, не затрагивающее лично.",декларация,"Государственные монополии, бюджетные учреждения",,,,
2,"Зрелость, современный контекст",Война и её влияние на личную жизнь,"Респондент выражает антивоенную позицию, ссылается на опыт Второй мировой войны, отмечает страх за близких из-за обстрелов и нестабильности.","Ну, я вообще, в принципе, против любой войны. ... Обстрелы. И постоянно страх за остальным, что они поступают.","Тревога, печаль","Мир, безопасность семьи, историческая память",Личный опыт войны и её последствий формирует антивоенную позицию и повышенную тревожность за близких. Присутствует критика повторения исторических ошибок.,эпизод,,False,,,
