id,life_stage,theme,summary,quote,emotion,values,sociological_note,type,institution,collapse_context,housing_promised,market_participation,location_preference
6,"зрелость, настоящее время",Национальная идентичность и культурная принадлежность,"Респондентка отмечает армянские корни, но подчеркивает, что в семье говорили на русском, и она полностью адаптирована к российской культуре. Отношения с родственниками осложнены политическими и мировоззренческими разногласиями.",Армянский я не знаю. Я этническая армянка. То есть в доме говорили на русском абсолютно адаптированная история.,"нейтральность, рациональность","адаптация, открытость, самостоятельность","Кейс иллюстрирует типичный для мегаполисов опыт этнической ассимиляции и размывания национальных границ идентичности, а также влияние политических событий на семейные отношения.",декларация,"семья, этническая группа",,,,
1,"зрелость, после 40 лет",Отношения с мужчинами и самоопределение,"Респондентка рефлексирует над своим опытом отношений с мужчинами, осознаёт повторяющиеся сценарии и внутренний диссонанс между ожиданиями и реальностью. Она отмечает, что её самостоятельность и умение принимать решения делают невозможным традиционный сценарий отношений, заложенный в детстве. При этом она признаёт, что сильный пол — это женщины, а не мужчины, и у неё нет иллюзий относительно мужского пола.","Я в этом понимаю, что эта история невозможная, потому что я сама почти мужчина. Я принимаю решения. И у меня нет уже с жизнью иллюзий по мужскому полу.","самоирония, принятие, лёгкая грусть","самостоятельность, честность с собой, принятие себя, независимость",Респондентка демонстрирует критическое отношение к гендерным ролям и традиционным ожиданиям от женщин в отношениях. Её опыт иллюстрирует тенденцию к индивидуализации и переосмыслению женской идентичности в зрелом возрасте.,декларация,"гендерные нормы, семейные сценарии",,False,False,
2,"зрелость, после 40 лет","Одиночество, страхи и забота о будущем","Респондентка размышляет о будущем и отсутствии партнёра рядом, признаёт, что иногда задумывается о возможных рисках одиночества, но стратегию выстраивает не для себя, а для дочери, чтобы не травмировать её.","Я в единственный момент, вот даже врать не буду, я тогда, ну, 48, так, Гая, ты не боишься, что тебя что-нибудь схлопнет, ну, рано или поздно это произойдет? А у тебя никого под боком-то нет, ну, если вдруг что.","тревога, забота, рациональность","забота о близких, ответственность, рациональность","В зрелом возрасте одиночество становится предметом рационального анализа, а забота о будущем смещается с себя на детей. Это отражает сдвиг в структуре семейных ценностей и стратегий преодоления жизненных рисков.",эпизод,семья,,False,False,
3,"зрелость, после 40 лет",Отношения с дочерью,"Респондентка описывает отношения с дочерью как близкие, но не навязчивые. Дочь самостоятельна, живёт отдельно, но в сложных вопросах обращается к матери за советом. Встречи и общение происходят по желанию, без давления.","У нас нет такого, что каждый день звонить, как дела, как ты себя чувствуешь. Нет. Каждый живёт своей жизнью. Встречаемся, когда хотим, когда маме захочется.","спокойствие, гордость, удовлетворение","самостоятельность, уважение личных границ, поддержка","Отношения между взрослыми детьми и родителями строятся на уважении автономии и экспертной поддержке, что характерно для современных городских семей.",декларация,семья,,False,False,
4,"зрелость, после 40 лет",Дружба и социальный круг,"Друзья — важнейшая ценность для респондентки. Она гордится своим окружением, отмечает разнообразие и душевное богатство друзей. Умеет объединять людей вокруг себя, инициирует совместные активности. Отдельно выделяет близких подруг, в том числе вернувшуюся после долгого перерыва подругу детства.","Глядя на друзей и предполагая, что скажи мне, кто твой друг, я понимаю, что я, наверное, очень крутая. Очень скромно.","гордость, благодарность, радость","дружба, душевная близость, разнообразие, инициатива","Дружеские связи становятся опорой и источником самоидентификации, особенно в условиях индивидуализации и ослабления традиционных семейных структур.",декларация,"неформальные сети, дружба",,False,False,
5,"зрелость, после 40 лет",Взаимопомощь и самостоятельность,"Респондентка привыкла рассчитывать только на себя, даже в мелочах. Приводит пример из бассейна, когда не сразу обратилась за помощью, хотя это было проще. Отмечает, что чаще помогает другим, чем просит о помощи сама.","Я настолько привыкла, в принципе, и выстроила своё, видимо, рассчитывать только на себя, что мы даже иногда смеёмся.","самоирония, лёгкая усталость, осознанность","самостоятельность, помощь другим, рефлексия",Самостоятельность и внутренняя установка на самодостаточность часто формируются как ответ на жизненные трудности и становятся частью идентичности современных женщин.,декларация,"дружба, индивидуализм",,False,False,
6,"зрелость, после 40 лет","Здоровье, образ жизни и трансформация привычек","Респондентка рассказывает о значительных изменениях в образе жизни: снижении веса, изменении пищевых привычек, введении физической активности (бассейн, пешие прогулки). Отмечает, что не ставила целью похудеть, но изменения произошли естественно. Также упоминает отказ от курения после 30 лет стажа.","Я всегда думала, что 70 – это прям мой вес. И у меня не стояла задача худеть. Я просто ввела активный спорт. В рамках тренировки я пошла плавать, потому что я обожаю плавать.","удивление, удовлетворение, азарт","здоровье, развитие, самосовершенствование, игра","Изменения в образе жизни происходят не под давлением внешних норм, а как результат внутренней мотивации и интереса к себе. Это отражает тенденцию к осознанному отношению к здоровью в зрелом возрасте.",перелом,"здравоохранение, спорт",,False,True,
1,"Взрослая жизнь, зрелость",Отношение к алкоголю и опыт утраты,"Респондентка рассказывает о своем отношении к алкоголю: фаза активного употребления прошла, сейчас она не пьет из-за занятий спортом, но не испытывает ограничений. Важным фактором стало то, что отец умер из-за алкоголя, что оставило след в памяти.",Просто у меня папа умер. Катализатором был алкоголь. Это в памяти осталось.,"Спокойствие, принятие, легкая грусть","Осознанность, здоровье, свобода выбора","Опыт утраты близкого человека из-за алкоголя формирует зрелое и ответственное отношение к употреблению, без категоричности и запретов.",эпизод,Семья,1.0,,,
2,"Настоящее время, зрелость",Здоровье и отношение к медицине,"Респондентка ощущает себя комфортно для своего возраста, хронические заболевания не мешают жизни. Предпочитает официальную медицину, не принимает лекарства без назначения врача, не доверяет народной медицине. Не видит разницы между коммерческой и государственной медициной, главное — профессионализм врача.","Я никогда не ем таблетки без назначения. И народная медицина, естественно. Нет.","Уверенность, рациональность","Здравомыслие, доверие к профессионалам, ответственность","Демонстрируется высокий уровень медицинской грамотности и критичности, характерный для людей с опытом и образованием.",декларация,Медицина,1.0,,,
3,Пандемия COVID-19,Вакцинация и отношение к прививкам,"Вакцинировалась от COVID-19 вынужденно для получения визы. В целом положительно относится к вакцинации, считает это важной частью культуры, унаследованной из советского прошлого. Делала прививки себе и дочери, пока был ДМС.",Я как ребенок Советского Союза отношусь положительно. Я понимаю все плюсы.,"Рациональность, легкая ностальгия","Рациональность, забота о здоровье, уважение к традициям","Позиция респондентки отражает советский опыт массовой вакцинации и доверие к научному подходу, но также демонстрирует прагматизм в современных условиях.",эпизод,"Медицина, государство",1.0,,,
4,"Настоящее время, зрелость",Стратегии заботы о здоровье,"При возникновении проблем со здоровьем обращается только к врачу, не занимается самолечением по интернету. Использует интернет для получения информации, но окончательное решение доверяет профессионалам.","Вариант поставил диагноз в Google, иди лечись в Яндекс, это не мой вариант.","Уверенность, критичность","Доверие к профессионалам, ответственность",Показательна высокая критичность к интернет-диагностике и ориентация на традиционную медицину.,декларация,Медицина,1.0,,,
5,"Настоящее время, зрелость",Психологическое состояние и саморефлексия,"Респондентка признает раздражительность как черту характера, приняла это в себе. Опыт тренерства в 2007 году стал переломным моментом в саморазвитии и саморефлексии. Не обращается к психологам, предпочитает разбираться в себе самостоятельно и с помощью близких.","Я хочу разбираться в людях, а для этого мне надо разобраться в себе.","Самоирония, принятие, уверенность","Саморазвитие, честность, самостоятельность",Опыт корпоративного обучения и тренерства способствует развитию навыков саморефлексии и психологической устойчивости.,узел,"Работа, корпоративная культура",1.0,,,
6,Период утраты близкого человека,Переживание утраты и обращение к нетрадиционным практикам,"Единственный опыт обращения к нетрадиционным практикам (к 'тётеньке') был связан с тяжелой утратой. В целом считает, что если есть близкие, с которыми можно быть откровенной, психолог не нужен.","У меня такие люди есть, поэтому мне не нужен психолог. У меня есть я, и у меня есть такие люди...","Грусть, благодарность, принятие","Дружба, доверие, самостоятельность",Демонстрируется высокая значимость социальных связей и доверия в кругу близких как ресурса психологической поддержки.,эпизод,"Семья, друзья",1.0,,,
7,"Настоящее время, зрелость",Забота о здоровье как инвестиция в будущее,"Респондентка осознанно заботится о здоровье, воспринимает это как вклад в будущее, особенно в контексте заботы о дочери.","Это вклад в будущее, то есть так, как мы, естественно, все не молодеем, мы стареем, и вы этот вклад делаете уже сейчас.","Осознанность, спокойствие","Забота о будущем, ответственность","Зрелое отношение к здоровью как к ресурсу, важному для себя и семьи.",декларация,Семья,1.0,,,
8,"Настоящее время, зрелость",Финансовое положение и источники дохода,"Основной источник дохода — вклад, который позволяет покрывать ипотеку. Есть разовые заработки. В прошлом был высокий доход, сейчас расходы оптимизированы под текущие потребности.","У меня есть вклад. Немного, но они позволяют мне покрывать ипотеку.","Рациональность, спокойствие","Финансовая грамотность, независимость","Переход от высокого дохода к более скромному, но стабильному финансовому положению, характерен для зрелого возраста и адаптации к изменяющимся жизненным обстоятельствам.",эпизод,Банковская система,1.0,,"Пассивное инвестирование, ипотека",
9,Периоды разного финансового положения,"Потребление, расходы и отношение к деньгам","В периоды высокого дохода позволяла себе больше, дарила дорогие подарки друзьям, не считала расходы. Сейчас более осознанно относится к тратам, но не экономит на важных для себя вещах (спорт, театры). Спонтанно купила квартиру и не пожалела.",Я квартиру спонтанно купила. И ни разу об этом не пожалела.,"Удовлетворение, легкая ностальгия","Щедрость, осознанность, гибкость",Опыт финансовых взлетов и падений формирует гибкость и умение адаптироваться к разным экономическим условиям.,эпизод,,1.0,True,,
10,"Настоящее время, зрелость",Потребительское поведение и отношение к акциям,"Профессиональный опыт в продажах влияет на восприятие акций и скидок. Отмечает, что акции в России часто искусственные, но в целом положительно относится к экономии. Предпочитает покупать бренды за границей по реальной цене.","Я могу сделать покупку совершенно необязательно мне, только восхитившись тем, как вкусно мне предложили своевременно.","Прагматизм, профессиональный интерес","Рациональность, профессионализм, экономия","Профдеформация влияет на потребительское поведение, формируя критичность к маркетинговым инструментам.",декларация,,1.0,,"Потребление, международные покупки",
11,"Настоящее время, зрелость",Использование маркетплейсов и критерии выбора,"Пользуется маркетплейсами для мелких и бытовых покупок, но одежду предпочитает заказывать в Европе. Хорошо понимает ценообразование на маркетплейсах благодаря опыту брата. Сравнивает цены на разных площадках.","Я открыла маркетплейс, сравнила цены, сравнила всегда на каждой площадке и заказала.","Рациональность, уверенность","Осознанность, экономия, информированность",Потребительская грамотность и опыт работы в продажах формируют взвешенный подход к покупкам.,декларация,,1.0,,Онлайн-покупки,
12,"Настоящее время, зрелость",Отношение к крупным и повседневным покупкам,"При выборе дорогих вещей руководствуется функциональностью, а не брендом или новизной. Не стремится покупать в кредит, кроме ипотеки. К поддержанным вещам относится избирательно: бытовую технику может купить, если есть причина, одежду — нет.","Я функциональщик. Я четко понимаю, мне надо, чтобы была вот эта или не была функция.","Прагматизм, уверенность","Функциональность, рациональность, независимость","Формируется зрелый, рациональный стиль потребления, характерный для людей с опытом экономических кризисов.",декларация,,1.0,,"Покупка недвижимости, бытовой техники, отказ от кредитов",
13,"Настоящее время, зрелость",Стратегии повседневного потребления,"Использует как офлайн, так и онлайн покупки. Заказывает доставку для тяжелых или неудобных товаров. Предпочитает готовить сама, но не имеет предубеждений против готовой еды.","Я потребитель хитрый, тяжелый, я заказываю доставкой, начиная от земли для цветов...","Практичность, гибкость","Удобство, рациональность, гибкость",Гибкое сочетание разных каналов потребления и отсутствие предубеждений к новым форматам.,декларация,,1.0,,"Онлайн и офлайн покупки, доставка",
