id,life_stage,theme,summary,quote,emotion,values,sociological_note,type,institution,collapse_context,housing_promised,market_participation
8,Взрослая жизнь,Уход за больным родственником,"Респондент ухаживал за дедом после инсульта, считает это естественным и не испытывает негативных эмоций по этому поводу.","Я за ним ухаживал. Но я думаю, ему было бы неприятно, если бы его дочь его подмывала... Я после учебы, после работок или выходные проводил свое время и очень удовольствием.","Спокойствие, забота, принятие","Семейная поддержка, забота о близких, достоинство",Демонстрируется традиционная семейная солидарность и гендерные роли в уходе за пожилыми родственниками.,эпизод,,1.0,False,
9,Настоящее время,Отношение к будущему здоровью и потере трудоспособности,"Респондент регулярно следит за здоровьем по собственной инициативе, мыслей о потере трудоспособности избегает, считает это равносильным смерти.","Потеря подобных способностей для меня, человеку ведущего активный образ жизни, равности на смерти. Для меня лучше смерть, чем потеря умения двигаться.","Тревога, категоричность","Активность, независимость, самоконтроль","Высокая ценность физической автономии и активности, страх утраты контроля над телом.",декларация,,1.0,,
10,Настоящее время,Финансовое положение и источники дохода,"Респондент работает, подрабатывает учителем физкультуры и донором крови. Финансовое положение оценивает как достаточное, мотивирован не только деньгами, но и желанием помогать.","Зачем мне эти 3,5 копейки? Ну, грубо говоря, да? Вообще, я так понимаю, для кого-то это хорошие деньги. Просто хочется помочь людям. Почему нет?","Удовлетворенность, альтруизм","Помощь другим, достаточность, независимость","Донорство и подработки как часть идентичности, а не только экономической необходимости.",декларация,,1.0,,"официальная занятость, донорство"
11,Настоящее время,Структура расходов и отношение к потреблению,"Основная часть расходов идет на помощь семье, остальное — на коммуналку и немного на себя. Не склонен к спонтанным покупкам, экономии, не интересуется брендами.","70% точно уходит семье, однозначно, каждый месяц, остальные 30, по-разному... Весь логотип можно написать на три цвета. Черный, белый и серый, собственно.","Рациональность, спокойствие","Семейная поддержка, умеренность, рациональность","Демонстрируется паттерн поддержки семьи взрослым ребенком, а также антипотребительские установки.",декларация,,1.0,,"минимализм, поддержка семьи"
12,Настоящее время,Потребительское поведение и отношение к крупным покупкам,"Респондент подходит к крупным покупкам осознанно, не доверяет отзывам, ориентируется на качество и производителя, не подвержен влиянию рекламы.","Если посмотрите на Google карты, то у вас будет отмечена гора Everest... И даже у нее есть негативные отзывы. Как после этого играть отзывы?","Скепсис, рациональность","Осознанность, независимость, критическое мышление","Потребительское поведение строится на личном опыте и анализе, а не на внешних источниках и маркетинговых стратегиях.",декларация,,1.0,,осознанное потребление
1,"Молодость, ранняя самостоятельность",Финансовые ошибки и опыт с кредитами,"В молодости респондент взял кредитку и быстро потратил деньги, что привело к финансовым трудностям. Этот опыт стал для него уроком, после чего он избегает кредитов.","Был опыт плачевный, по молодости, не только-только 18, кредитка от деньгов на 30 тысяч пошел везде тратить, просадил, денег нет. Но слава богу, когда погасил своими трудами, ну и собственно в кредитах я больше не нуждался.","Сожаление, облегчение","Финансовая самостоятельность, ответственность, избегание долгов","Опыт ранних финансовых ошибок типичен для молодых людей, впервые столкнувшихся с кредитными инструментами. Исправление ситуации собственными силами формирует ответственное отношение к деньгам.",перелом,,1.0,,Потребительский кредит
2,"Взрослая жизнь, самостоятельность",Финансовая безопасность и сбережения,"Респондент выстроил систему сбережений: подушка безопасности на полгода, отдельные накопления на отпуск и спорт, а также 'запасной карман' на экстренные случаи.","Есть подушка безопасности. То есть, у меня там н-ная сумма, при которой, не дай бог, что с работой, я полгода проживу без работы.","Уверенность, спокойствие","Безопасность, предусмотрительность, самостоятельность","Стремление к финансовой независимости и защите от рисков характерно для людей, переживших периоды нехватки средств. Формирование нескольких видов сбережений — индикатор зрелого финансового поведения.",эпизод,,1.0,,"Сбережения, финансовое планирование"
3,Взрослая жизнь,Жилищный вопрос и наследство,"Респондент владеет домом и квартирой, полученной по наследству. Квартиру сдаёт, предпочитает жить в доме из-за ощущения свободы и уединения.","Больше всего душевные. Мимое ощущение иллюзии свободы, честно говоря. Без шума, справа-слева, сверху-снизу.","Удовлетворение, спокойствие","Свобода, независимость, рациональность",Предпочтение частного дома городской квартире отражает ценность личного пространства и независимости. Сдача квартиры — пример рационального использования активов.,эпизод,"Наследование, рынок аренды",1.0,False,
4,Детство и юность,Опыт нехватки денег,"В детстве и юности респондент сталкивался с острой нехваткой денег, что повлияло на его отношение к финансовой безопасности.","Когда живешь на съемной квартире, а денег хватает только на пачку сигарет. Там у тебя где-то завалялись пакетики с чёрным чаем и килограмм сахара.","Грусть, ностальгия","Выживание, стойкость, скромность",Опыт бедности в детстве часто формирует у взрослых стратегию накопления и осторожного отношения к расходам.,эпизод,,1.0,,
5,Взрослая жизнь,Покупки и потребительское поведение,"Респондент предпочитает покупать качественные вещи, не избегает б/у, но не занимается перепродажей. Крупные покупки совершает через знакомых-экспертов.","Любого веща, если оно качественное. Почему бы и нет, но было вещи я давно не покупал.","Рациональность, спокойствие","Качество, прагматизм, доверие к экспертам","Потребительское поведение строится на доверии к экспертам и рациональном подходе к покупкам, что характерно для зрелых потребителей.",эпизод,,1.0,,"Покупки, вторичный рынок"
6,Взрослая жизнь,Советы и принятие решений,"Респондент советуется с близкими и экспертами при принятии важных решений, особенно если это их компетенция.","Происходит совещание с знакомыми, с матушкой, с бабушкой, с дедушкой. Вот, конечно, происходит.","Доверие, уважение","Семейственность, коллективизм, уважение к опыту","Коллективное принятие решений и опора на мнение старших — черта, характерная для семейно-ориентированных культур.",декларация,,1.0,,
7,"Взрослая жизнь, периферия","Питание, готовка и доставка еды","Респондент живёт в посёлке, редко пользуется доставкой еды, предпочитает готовить сам простую пищу. Получает удовольствие от самостоятельной готовки.","Мне больше удовольствие заставляет самому готовить, чем кому-то отдавать. Ну, кроме соседской бабушки, конечно.","Удовлетворение, спокойствие","Самостоятельность, простота, умеренность","Жизнь вне города ограничивает доступ к сервисам доставки, формируя самостоятельные бытовые практики.",эпизод,Сельское поселение,1.0,,
8,Взрослая жизнь,Отношение к образованию,"Респондент учился на бюджете, проходил платные курсы для повышения квалификации. Считает, что платное образование — выход для тех, кто не смог поступить на бюджет.","Бюджет это для ребят, которые действительно учатся, у которых мозги на месте. Классно это все-таки для ребят, у которых не хватило ума в школе правильно учиться.","Рациональность, лёгкая ирония","Образование, саморазвитие, прагматизм",Отношение к платному и бесплатному образованию отражает социальные стереотипы и опыт респондента.,декларация,"Колледж, курсы повышения квалификации",1.0,,
9,Взрослая жизнь,Финансовая самостоятельность и принятие решений,"Респондент самостоятельно принял решение о создании финансовой подушки безопасности, исходя из прошлого опыта нехватки денег.","Поэтому было принято решение, лично мной, ни с кем не согласовывавшись, подготовить для себя некую безопасность.","Уверенность, самостоятельность","Независимость, ответственность",Самостоятельное принятие решений о финансовой безопасности — индикатор зрелости и личной ответственности.,перелом,,1.0,,
10,Взрослая жизнь,Деньги и их значение,"Для респондента деньги — это способ обеспечить свободу, безопасность, помочь другим и получать эмоции. Особое значение придаёт возможности оплатить качественную медицину.","Для меня деньги — это получение эмоций, получение воспоминаний, ярких эпизодов в жизни.","Размышление, философичность","Свобода, безопасность, помощь близким, эмоции","Деньги рассматриваются не как цель, а как инструмент для достижения жизненных целей и поддержки близких.",декларация,,1.0,,
11,Взрослая жизнь,Достаточность дохода,"Респондент считает свой доход достаточным для текущих нужд, не стремится к увеличению дохода, но отмечает, что ситуация может измениться с появлением семьи.","У меня достаточно подушек безопасности и то, сколько я зарабатываю. Другой вопрос в том, что твой имя может поменяться при наличии жены и детей.","Удовлетворение, реализм","Умеренность, реализм, ответственность","Ориентация на достаточность, а не на постоянное увеличение дохода, характерна для людей, ценящих стабильность.",декларация,,1.0,,
12,Взрослая жизнь,Взаимодействие с государственными структурами,"Опыт взаимодействия с полицией, пожарными и больницами в целом положительный. Отмечает разницу между частной и государственной медициной.","Полиция у меня хорошая, с пожарными структурами был, то есть горело дома соседей, вызывали пожарных, приехали оперативно, вопросов нет.","Удовлетворение, спокойствие","Доверие к институтам, прагматизм","Положительный опыт взаимодействия с госструктурами формирует доверие к институтам, хотя отмечается и разница в качестве услуг.",эпизод,"Полиция, пожарные, больницы",1.0,,
13,Взрослая жизнь,Семейные отношения и помощь родственникам,"Респондент помог тёте с квартирой, отказавшись от своей доли, чтобы поддержать её в сложной ситуации. Сохраняет хорошие отношения с родственниками.","Я принял решение, что это будет моя им минимальная оказанная помощь, которую я могу оказать. И, как я ранее повторял, за меня тогда эти деньги не имеют никакой ценности, они не мои.","Альтруизм, удовлетворение","Семья, помощь, бескорыстие",Готовность жертвовать материальными благами ради семьи — показатель высокой ценности семейных связей.,эпизод,"Наследование, нотариус",1.0,,
14,Армейский период,Опыт службы в армии (дисбат),Служба в дисциплинарном батальоне стала для респондента важным опытом ответственности и гордости. Получил признание и рекомендации.,"Это ответственность. Это огромная ответственность, понимание того, что фактически жизнь элных людей, пускай это и заключенные, да, они в твоих руках.","Гордость, серьёзность","Ответственность, долг, профессионализм","Служба в дисбате — уникальный опыт, формирующий чувство ответственности и гордости за преодолённые испытания.",узел,"Армия, дисциплинарный батальон",1.0,,
15,Юность,Татуировки как способ самовыражения,В подростковом возрасте сделал татуировки для самовыражения и подражания отцу. Сейчас жалеет об этом и копит на их удаление.,"Это история две татуировки. Это история желания выделиться в подростковом возрасте, привлечь на себя внимание.","Сожаление, самоирония","Самовыражение, память о близких, рефлексия","Татуировки в юности часто связаны с поиском идентичности и желанием выделиться, но с возрастом отношение к ним меняется.",эпизод,,1.0,,
1,"Взрослая жизнь, зрелость",Отношение к политике и государству,"Респондент осознаёт различия между СССР и современной Россией, имеет свои взгляды на политику, но не считает себя вправе судить действия властей. Не обсуждает политические взгляды даже с близкими, чтобы избежать конфликтов.","Понятие что хорошо, что плохо тяжело судить, когда ты обычный гражданин. Другой вопрос, когда ты человек, ответственный за таких граждан, как я. Не мне судить, что хорошо, что плохо.","Взвешенность, осторожность","Сдержанность, уважение к чужой позиции, избегание конфликтов","Респондент демонстрирует характерную для части российского общества политическую апатию и осторожность в публичном выражении мнения, что может быть связано с недоверием к институтам и опасением последствий.",декларация,"государство, семья",,,
2,Взрослая жизнь,Потребление информации и отношение к СМИ,"Респондент получает новости из разных источников: интернет, официальные СМИ, Telegram-каналы. Однако не увлекается обсуждением политики в кругу друзей и не стремится быть 'диванным экспертом'.","У меня четкая понятие позиции, я распространяю на свой круг, если вы хотите обсуждать политику, обсуждайте, я не крымник, если я сижу за столом.","Сдержанность, дистанция","Личная автономия, информационная избирательность","Респондент демонстрирует индивидуалистский подход к потреблению информации, избегает вовлечения в массовые дискуссии, что может говорить о недоверии к коллективным обсуждениям и стремлении к личной независимости.",декларация,,,,пассивный потребитель информации
3,Взрослая жизнь,Опыт использования цифровых технологий и отношение к ним,"Респондент использует цифровые технологии как хобби, знаком с конструкторами сайтов, базово освоил инструменты, но не считает себя специалистом. Использует нейросети для решения бытовых и рабочих задач.","Ну как, я балуюсь. По сравнению с действительно специалистами этого дела, я не могу выше оценить свои труды, как балуюсь. Базово я их знаю, базово я их освоил, но просто чтобы знать.","Скромность, интерес","Разносторонность, саморазвитие","Респондент относится к цифровым технологиям как к инструменту для расширения кругозора, но не стремится к профессионализации в этой сфере. Это отражает тенденцию к прагматичному использованию технологий среди зрелых пользователей.",эпизод,,,,осознанный пользователь
