id,life_stage,theme,summary,quote,emotion,values,sociological_note,type,institution,housing_promised,market_participation
1,Детство и юность,Семья и раннее окружение,"Респондент вырос в Луганской области, Украина, в семье с матерью и старшей сестрой. Отец ушёл из семьи, когда респондент был маленьким, и вскоре умер. Воспитанием занимались мама, бабушка и дедушка. Мама работала на заработках, чтобы содержать семью.","С мамой жили. Мама работала. Тогда работы не было в Украине. Ну как, плохая была. Мама работала на заработках, мы с сестрой.","спокойная констатация, лёгкая грусть","семейная поддержка, выживание, благодарность матери","Типичная для постсоветского пространства ситуация: неполная семья, материальные трудности, трудовая миграция матери. Отсутствие отца и опора на женскую часть семьи формируют устойчивость и самостоятельность.",эпизод,"семья, школа",0.0,0.0
2,Подростковый возраст,Проблемы с законом и поддержка семьи,"В подростковом возрасте респондент попал в плохую компанию, участвовал в проникновении в квартиру, за что получил условный срок. Мать поддерживала его в этот сложный период, что помогло избежать худших последствий.","Спасибо ей, что я не сел в тюрьму.","благодарность, облегчение, некоторая вина","поддержка близких, шанс на исправление","Случай с условным сроком иллюстрирует риски для подростков из неблагополучных или неполных семей, а также важность родительской поддержки для социальной адаптации.",перелом,"правоохранительная система, семья",0.0,0.0
3,Юность и ранняя зрелость,Образование и профессиональный выбор,"После 9 класса респондент поступил в училище на сборщика металлоконструкций, поскольку учёба в школе была неинтересна и не давалась. В училище учиться было проще и интереснее из-за практической направленности.","Мне сказали, что 10-11 класс – это не для тебя. Ну, пришлось идти в училище.","принятие, некоторая пассивность","прагматизм, ориентация на практику",Переход в профессиональное училище после 9 класса — распространённая стратегия среди молодёжи из семей с ограниченными ресурсами. Практическая направленность образования воспринимается как более доступная и полезная.,узел,ПТУ (профессиональное училище),0.0,1.0
4,Молодость,Начало трудовой деятельности и трудовая миграция,"После училища начал работать на заводе по профессии, но из-за нестабильности зарплаты и отсутствия заказов был вынужден ездить на заработки в Россию. Этот период длился до начала войны в 2014 году.","Ну, тоже перестали деньги платить, пришлось ездить в Россию. Ну, практически в России и работать, короче.","усталость, вынужденность","необходимость зарабатывать, адаптация к обстоятельствам",Трудовая миграция в Россию — типичная стратегия выживания для жителей востока Украины в условиях экономического кризиса и нестабильности.,эпизод,"завод, рынок труда",0.0,1.0
5,Молодость — зрелость,Война и вынужденная миграция,"С началом войны на Донбассе респондент окончательно уехал из Украины, работал в Москве в строительстве. Испытывал сложности из-за демпинга зарплат мигрантами и смены трудового коллектива.","Ну, потом я уехал, война началась. Вообще ж работы не было ничего. Ну, то ехал, в Москве работал на фирме я долго, там года четыре, наверное.","разочарование, усталость, адаптация","выживание, профессионализм, стабильность",Война становится фактором вынужденной миграции и смены профессии. Конкуренция с мигрантами из Средней Азии воспринимается как угроза привычному укладу труда.,перелом,"строительная фирма, рынок труда",0.0,1.0
6,Зрелость,Переезд в Санкт-Петербург и профессиональная адаптация,"После работы в Москве респондент по объявлению нашёл работу в Санкт-Петербурге, где устроился на завод по кораблестроению. Оценил близость работы к дому и официальное трудоустройство.","По объявлению нашел в Питере работу. На заводе. На фирме. Было объявление, мы приехали с другом, с Куном. И остались здесь.","удовлетворение, спокойствие","стабильность, профессионализм, близость к дому",Переезд в крупный город и официальное трудоустройство — стратегия закрепления и социальной интеграции мигранта.,узел,"завод, рынок труда",0.0,1.0
7,Зрелость,Личная жизнь и создание семьи,"В Санкт-Петербурге респондент познакомился с будущей женой, женился три года назад. Вместе накопили на комнату, что стало важным достижением. Семейная жизнь принесла спокойствие и стабильность.","Накопили на комнату, купили себе комнату. Ну, в принципе... Это спокойнее стало, суеты меньше стало.","удовлетворение, спокойствие","семья, стабильность, самостоятельность",Создание семьи и приобретение жилья — ключевые маркеры взрослости и социальной успешности для мигранта.,узел,"семья, рынок жилья",1.0,1.0
8,Зрелость,Военные сборы и опыт мобилизации,"В 2023 году респондент был призван на военные сборы в России, хотя не служил ранее из-за судимости. Испытывал стресс и неопределённость, подчёркивает разницу между добровольцами и мобилизованными.","Когда ты перешагнул забор воинской части, ты уже боевая единица, ты уже не человек. Ты рядовой какой-то части. Без вариантов.","стресс, отчуждение, принятие","долг, выживание, адаптация",Опыт мобилизации для мигранта с украинским прошлым — сложный идентификационный и психологический вызов. Отмечается отчуждение и отсутствие выбора.,перелом,"армия, государство",0.0,0.0
9,Настоящее,Повседневная жизнь и досуг,"Респондент описывает свой распорядок дня: ранний подъём, работа до вечера, отдых дома, встречи с коллегами по пятницам, прогулки и домашние дела на выходных. Жильё выбрано рядом с работой для удобства.","Вот смотрите, с 5 часов я просыпаюсь... на работе я нахожусь до 7 вечера. Прихожу с работы, поел и ложусь отдыхать. В пятницу мы идем по 50 грамм.","спокойствие, удовлетворение","рутина, стабильность, простые радости",Повседневная рутина и простые удовольствия становятся опорой для человека с опытом миграции и нестабильности. Близость работы и жилья — важный фактор качества жизни.,эпизод,"работа, жильё",1.0,1.0
1,Взрослая самостоятельная жизнь,Жилищные условия и соседи,"Респондент живет во вторичном жилье, хозяйка оставила почти все вещи. С соседями отношения в целом хорошие, но с соседями сверху бывают конфликты из-за шума, особенно в день зарплаты.","Шумят, да, алкаши. Приходится ходить когда-никогда. Успокаивать их, успокаивать надо. Не понимают по-людски.","Раздражение, усталость","Покой, порядок, самостоятельность","Жилищная ситуация типична для городских жителей среднего класса, сталкивающихся с проблемой соседства и шумом. Отражает распространённую проблему вторичного жилья и социального окружения.",эпизод,,0.0,
2,"Настоящее время, повседневность",Работа и трудовые отношения,"Респондент работает сверхурочно по собственному выбору, чтобы иметь возможность брать отгулы. Работает в государственной организации (кораблестроение), отмечает наличие соцгарантий, но считает, что людей сейчас не ценят.","Ну, это мой выбор, надо замок вовремя начать. Но есть возможность с этих сверхурочных два часа. Взять одну, знаете, вот. Ну как, в сумме этих наработанных часов можно взять отгул...","Сдержанность, прагматизм","Трудолюбие, стабильность, самостоятельность","Работа в госсекторе обеспечивает соцгарантии, но не всегда удовлетворяет в плане признания и зарплаты. Сверхурочная работа воспринимается как вынужденная мера для дополнительного отдыха.",эпизод,государственная организация,,
3,Настоящее время,Досуг и хобби,Респондент предпочитает смотреть сериалы и интересуется телефонией. Домашних животных не заводит из-за нежелания брать на себя дополнительную ответственность.,Тайный какой хобби? Телефония. За животными надо ухаживать.,"Спокойствие, рациональность","Личное пространство, ответственность",Выбор досуга и отказ от домашних животных отражают ориентацию на личное удобство и минимизацию обязательств.,декларация,,,
4,Настоящее время,Отношение к культуре и природе,"Респондент посещает музеи, отмечая, что жить в Петербурге и не ходить в музей странно. К природе относится спокойно, но летом любит выезжать на шашлыки к воде. Экологические проблемы его не волнуют.","Ну, как жить в Питере и не сходить в музей-то? Пусть экологи волнуются. Мне еще волноваться за экологию. Мне есть за что.","Ирония, легкая отстраненность","Традиции, прагматизм",Культурные практики воспринимаются как часть городской идентичности. Экологическая проблематика не входит в круг личных забот.,декларация,,,
5,Детство и влияние семьи,Религиозные и семейные традиции,"Респондент отмечает влияние бабушки, которая была верующей и приучила его к христианским праздникам. Также важны Новый год и дни рождения близких.","У меня бабушка была сильная, верующая сильно. Она меня как бы приучила. христианские для меня праздники.","Теплота, благодарность","Семейные традиции, религиозность",Религиозные и семейные традиции передаются по наследству и сохраняют значимость даже в зрелом возрасте.,узел,,,
6,Настоящее время,Отпуск и связь с родиной,"Респондент проводит отпуск, навещая маму на родине. Обычно отдых ограничен несколькими днями, идеальный отдых — поездка за границу, но пока это недостижимо.","Отпуск, вот сегодня первый день отпуска, вот с вами общаюсь. Поеду на родину в четверг.","Спокойствие, легкая тоска","Семья, стабильность, умеренность","Отпуск используется для поддержания семейных связей, а не для развлечений или путешествий. Идеалы отдыха остаются недостижимыми из-за финансовых ограничений.",эпизод,,,
7,Настоящее время,Удовлетворенность жизнью и усталость,"Респондент в целом доволен распорядком дня, но отмечает усталость и желание получать больше зарплаты вместо необходимости работать сверхурочно.","Ну, мне выбирать не с чего, я не знаю. Ну, что вам сказать? Ну, доволен я. Конечно, устаешь. Хотелось бы, чтобы в зарплату добавили, а не чтобы мне приходилось, допустим, сверхурочно работать.","Смирение, усталость","Стабильность, прагматизм",Обыденная удовлетворенность сочетается с усталостью и скрытым недовольством уровнем дохода.,декларация,,,
8,Взрослая жизнь,Семейные отношения и поддержка,"Респондент поддерживает регулярную связь с мамой и сестрой, отмечает, что с возрастом стал лучше понимать мать. С женой отношения теплые, ценит поддержку и ненавязчивость. Совместно планируют расширение жилья, бюджет делят по ролям.","Больше я ее начал понимать, что... Она ко мне не лезет. Ну как? Не... Как объяснить? Ну она меня поддерживает и... чтобы навязать свое что-то.","Признательность, спокойствие","Поддержка, самостоятельность, уважение личных границ",Семейные отношения строятся на взаимной поддержке и уважении автономии. Бюджетное планирование и совместные цели типичны для стабильных семей.,узел,,,
9,Взрослая жизнь,Дружба и социальные связи,"Респондент не имеет настоящих друзей, поддерживает в основном рабочие контакты. Потеря друзей связана с жизненными обстоятельствами, смертью, утратой контактов. Близкими считает маму и жену.","Наверное, нет таких друзей, чтобы назвать настоящим другом. Сейчас самые близкие это мне мама и жена моя.","Одиночество, принятие","Семья, честность, надежность",Сужение круга общения до семьи и коллег типично для зрелого возраста и рабочих людей. Дружба уступает место семейным связям.,декларация,,,
10,Настоящее время,Здоровье и образ жизни,"Респондент ощущает усталость, связывает это с возрастом и тяжелой работой. Питание не ограничивает, предпочитает мясо. Физическая активность ограничена работой. Хотел бы изменить образ жизни, если бы были деньги.","Если ты целый день в дыму... Уржавчины. Конечно, хотелось бы быть каким-нибудь миллионером и заниматься своим здоровьем.","Усталость, ирония","Здоровье, материальное благополучие","Физический труд и отсутствие ресурсов для заботы о здоровье типичны для рабочих профессий. Здоровье воспринимается как ресурс, зависящий от финансов.",декларация,,,
11,Настоящее время,Вредные привычки,"Респондент курит с восьмого класса, были попытки бросить, но неудачные. Курение воспринимает как привычку.","Как долго? С восьмого класса, кстати. Не знаю, это, наверное, привычка больше.",Смирение,"Привычка, реализм","Долгосрочные вредные привычки часто сопровождают представителей рабочих профессий, воспринимаются как часть повседневности.",эпизод,,,
12,Настоящее время,Отношение к медицине,"Респондент редко обращается к врачам, предпочитает государственные клиники. К народной медицине относится положительно, вспоминает детство. Считает, что доступ к качественной медицине зависит от денег.","Бесплатно это можно прийти, да. Вы сами знаете, пришел, бесплатно записали тебя, посмотрели. Допустим, вот как в стоматологию я пришел, бесплатная пломба бесплатная, а хорошая пломба 2000-3000.","Скепсис, прагматизм","Практичность, экономия",Недоверие к бесплатной медицине и ориентация на народные средства типичны для людей с опытом советской системы здравоохранения.,декларация,,,
13,Настоящее время,Эмоциональное состояние и поддержка,"Респондент отмечает, что депрессия бывает после алкоголя, справляется с ней сном. За помощью обращается к близким, в первую очередь к маме, жене, сестре. За здоровье близких переживает.","Да, бывает. Это после выпитого алкоголя. Вот постоянно какая-то депрессия. Сейчас самые близкие это мне мама и жена моя. Я думаю, что они меня любят и поддерживают.","Усталость, благодарность","Семья, поддержка",Семья выступает главным источником поддержки и эмоционального ресурса. Обращение к специалистам по психическому здоровью не рассматривается.,эпизод,,,
14,Настоящее время,Возрастные изменения и забота о будущем,"Респондент отмечает ухудшение зрения и снижение сил за последние два года, но пока это не влияет на работу. О будущем здоровье задумывается, но не предпринимает активных шагов.","Ну, зрение подсело буквально за два года. капитально силы.","Беспокойство, принятие","Здоровье, адаптация","Возрастные изменения воспринимаются как неизбежность, активная забота о здоровье затруднена из-за условий труда и ограниченных ресурсов.",узел,,,
1,"Зрелый возраст, семейная жизнь",Самостоятельность и забота о себе,"Респондент выражает уверенность в собственной самостоятельности и не рассчитывает на помощь других, кроме, возможно, супруги. Основная стратегия — полагаться на себя.","Супруга, если позаботится. Все надежды только на себя. Пока я жив, буду заботиться о себе я.","Уверенность, сдержанность","Самостоятельность, ответственность, независимость","Типичная для зрелых мужчин установка на самостоятельность и недоверие к внешней поддержке, отражает ценности индивидуализма и личной ответственности.",декларация,,,
